data_type,section,term_name,description,requirement_level_code,requirement_level,requirement_level_condition,term_type,unit,fixed_format,controlled_vocabulary_options,example,sample_type_specificity,source,URI,modifications.made
studyMetadata,Project,recordedBy,A list (concatenated and separated) of names of people responsible for the submitted dataset,M,Mandatory,NA,free text,NA,NA,NA,José E. Crespo,NA,dwc,https://dwc.tdwg.org/list/#dwc_recordedBy,description
studyMetadata,Project,recordedByID,A list (concatenated and separated) of the globally unique identifier for the people responsible for the submitted dataset,R,Recommended,NA,free text,NA,NA,NA,https://orcid.org/0000-0002-1825-0097  |  https://orcid.org/0000-0002-1825-0098,NA,dwc,https://dwc.tdwg.org/list/#dwc_recordedByID,description
studyMetadata,Project,project_contact,"A contact person and their contact (i.e., email address) for data enquiry",M,Mandatory,NA,free text,NA,NA,NA,xxxx@yyyy.com,NA,new,NA,Newly added
studyMetadata,Project,institution,An institution having custody of the object(s) or information referred to in the record.,R,Recommended,NA,free text,NA,NA,NA,Curtin University,NA,new,NA,Newly added
studyMetadata,Project,institutionID,An identifier for the institution having custody of the object(s) or information referred to in the record.,R,Recommended,NA,free text,NA,NA,NA,http://grscicoll.org/institution/museum-southwestern-biology,NA,dwc,http://rs.tdwg.org/dwc/terms/institutionID,NA
studyMetadata,Project,project_name,Name of the project within which the sequencing was organized,R,Recommended,NA,free text,NA,NA,NA,Forest soil metagenome,NA,mixs | gbifDNAext,https://w3id.org/mixs/0000092,NA
studyMetadata,Project,project_id,"A brief, concise project identifier with no spaces or special characters, ensuring machine readability. This ID will be used in data file names as 'project_id'.",M,Mandatory,NA,free text,NA,NA,NA,noaa-aoml-gomecc4,NA,nmdc | noaa,https://w3id.org/nmdc/project_id,NA
studyMetadata,Project,parent_project_id,"An identifier or name of the overarching (parent) project that encompasses and organizes multiple related sub-projects, each identified by a unique project_id",O,Optional,NA,free text,NA,NA,NA,noaa-aoml-gomecc,NA,new,NA,NA
studyMetadata,Project,study_factor,"The variable(s) examined in the study, including those of direct interests to address study aims and covariates.",O,Optional,NA,free text,NA,NA,NA,benthic habitat types | diurnal time series | filter types,NA,new,NA,NA
studyMetadata,Project,assay_type,"The method used in the eDNA study to detect taxon/taxa of interest in environmental sample. A targeted eDNA assay is designed to detect the presence of a specific species or a small subset of taxa (such as a genus or family) using techniques like quantitative PCR (qPCR). This contrasts with a metabarcoding eDNA assay which aims to characterize the composition of broader taxonomic communities, often encompassing multiple phyletic groups, by utilising high-throughput sequencing such as metabarcoding",M,Mandatory,NA,controlled vocabulary,NA,NA,targeted | metabarcoding | other:,targeted,NA,new,NA,Newly added
studyMetadata,Project,sterilise_method,the protocols to minimise contaminations in the field and/or laboratory,HR,Highly recommended,NA,free text,NA,NA,NA,Sampling bottles were rinsed with 10% bleached and DI water. Single-use syringes and capsule filters were used for filtration. Single-use gloves were used to collect and filter each sample.,NA,new,NA,Newly added
studyMetadata,Project,neg_cont_0_1,"Were negative controls applied during the project? Yes = 1, No = 0. For further details, record the types of negative controls under the term neg_cont_type in studyMetadata",HR,Highly recommended,NA,Boolean,NA,NA,0 | 1,1.0,NA,new,NA,Newly added
studyMetadata,Project,pos_cont_0_1,"Were positive controls applied during the project? Yes = 1, No = 0. For further details, record the types of positive controls under the term pos_cont_type in studyMetadata",HR,Highly recommended,NA,Boolean,NA,NA,0 | 1,1.0,NA,new,NA,Newly added
studyMetadata,Data management,checkls_ver,The version of the eDNA metadata checklist used to format the data,M,Mandatory,NA,numeric,NA,NA,NA,FAIRe_checklist_v1.0,NA,new,NA,NA
studyMetadata,Data management,mod_date,"The last date on which the database information was modified, following the ISO 8601 format of yyyy-mm-dd",R,Recommended,NA,fixed format,NA,yyyy-mm-dd,NA,2014-09-09,NA,nmdc,https://w3id.org/nmdc/mod_date,description
studyMetadata,Data management,license,A legal document giving official permission to do something with the resource.,R,Recommended,NA,free text,NA,NA,NA,http://creativecommons.org/licenses/by/4.0/legalcode,NA,dwc,https://dwc.tdwg.org/terms/#dcterms:license,NA
studyMetadata,Data management,rightsHolder,A person or organization owning or managing rights over the resource.,R,Recommended,NA,free text,NA,NA,NA,The Regents of the University of California,NA,dwc,http://purl.org/dc/terms/rightsHolder,NA
studyMetadata,Data management,accessRights,Information about who can access the resource or an indication of its security status.,R,Recommended,NA,free text,NA,NA,NA,not-for-profit use only ,NA,dwc,http://purl.org/dc/terms/accessRights,NA
studyMetadata,Data management,informationWithheld,"Additional information that exists, but that has not been shared in the given record.",O,Optional,NA,free text,NA,NA,NA,location information not given for endangered species,NA,dwc,http://rs.tdwg.org/dwc/terms/informationWithheld,NA
studyMetadata,Data management,dataGeneralizations,"Actions taken to make the shared data (i.e. location, date) less specific or complete than in its original form. Suggests that alternative data of higher quality may be available on request. Note this is not related to genetic generalisation within bioinforamtics workflows (i.e., OTU clustering).",O,Optional,NA,free text,NA,NA,NA,Coordinates generalized from original GPS coordinates to the nearest half degree grid cell.,NA,dwc,http://rs.tdwg.org/dwc/terms/dataGeneralizations,description
studyMetadata,Data management,bibliographicCitation,A bibliographic reference for the resource.,R,Recommended,NA,DOI,NA,NA,NA,DOI: 10.1111/mec.15382,NA,dwc,http://purl.org/dc/terms/bibliographicCitation,NA
studyMetadata,Data management,associated_resource,"A related resource that is referenced, cited, or otherwise associated to the sequence. i.e., links to a project website, submitted raw sequence data and environmental metadata.",O,Optional,NA,free text,NA,NA,NA,http://www.earthmicrobiome.org/,NA,mixs,https://w3id.org/mixs/0000091,description
studyMetadata,Data management,code_repo,Link to public repository where analysis code is archived,R,Recommended,NA,free text,NA,NA,NA,https://github.com/aomlomics/gomecc,NA,NOAA,NA,NA
sampleMetadata | ampData | stdData | experimentRunMetadata,Sample information,samp_name,"Sample Name is a name that you choose for the sample. It can have any format, but we suggest that you make it concise, unique and consistent within your lab, and as informative as possible. Every Sample Name from a single Submitter must be unique.",M,Mandatory,NA,free text,NA,NA,NA,S01,NA,mixs | gbifDNAext,https://w3id.org/mixs/0001107,NA
sampleMetadata,Sample information,samp_category,"A type/category of a sample. 'Sample"" includes biological and technical replicates. If negative or positive control was selected, provide further infomration under the terms fill neg_cont_type and pos_cont_type.",M,Mandatory,NA,controlled vocabulary,NA,NA,sample | negative control | positive control | PCR standard | other:,sample,NA,new,NA,NA
sampleMetadata,Sample information,neg_cont_type,"A negative control type used in an investigation. See Table 2 in Klymus et al. 2024 (DOI) for the description of each control type, how and why it's created. For example, process negative is a sample added during processing that lacks target DNA, such as blank filter papers.",M,Mandatory,If samp_category = negative control,controlled vocabulary,NA,NA,site negative | field negative | process negative | extraction negative | PCR negative | other:,field negative | process negative | extraction negative | PCR negative,NA,mixs,https://w3id.org/mixs/0001321,description | field_type
sampleMetadata,Sample information,pos_cont_type,"A positive control type used in an investigation. See Table 2 in Klymus et al. 2024 (DOI) for the description of each control type, how and why it's created. For example, PCR positive is a introduced target material to monitor for PCR success, including moch community samples. Provide further details (e.g., synthetic DNA) where applicable.",M,Mandatory,If samp_category = positive control,free text,NA,NA,NA,PCR positive of synthetic DNA,NA,mixs,https://w3id.org/mixs/0001322,NA
sampleMetadata,Sample relations,sample_derived_from,"This term refers to the samp_name of the original (or parent) sample from which the current sample was derived. For example, if sample ""S01"" (the parent sample) was collected at a sampling site and later subsampled into three child samples with samp_names ""S01_1"", ""S01_2"", ""S01_3"", then ""S01"" is the value for sample_derived_from in each of the child samples. This includes the case of pcr technical replicates.",O,Optional,NA,fixed format,NA,(a list of) samp_name,NA,S01,NA,INSDC,NA,NA
sampleMetadata,Sample relations,sample_composed_of,"This term contains a list of samp_name values that represent the original samples combined to form the current sample. For example, if environmental samples ""S01"" and ""S02"" were pooled into a single sample ""S03"" at any stage (e.g., before or after DNA extraction), then the value for sample_composed_of in ""S03"" would be ""S01 | S02"".",O,Optional,NA,fixed format,NA,(a list of) samp_name,NA,S01 | S02,NA,INSDC,NA,NA
sampleMetadata,Sample relations,rel_cont_id,(A list of) samp_id of the negative and positive controls realted to each sample,R,Recommended,NA,free text,NA,NA,NA,field_blank1 | ext_blank2 | pcr_ntc_plate1 | pcr_posC_plate1,NA,new,NA,NA
sampleMetadata,Sample relations,biological_rep_relation,"This term lists the samp_name of biological replicates associated with the current sample. For example, if three biolgoical replicates (""S01_1"", ""S01_2"", and ""S01_3"") were collected from the same sampling site, the value for biological_rep_relation in each of these replicates would be ""S01_1 | S01_2 | S01_3"".",O,Optional,NA,fixed format,NA,(a list of) samp_name,NA,S01_1 | S01_2 | S01_3,NA,new,NA,NA
sampleMetadata,Sample collection,decimalLongitude,"The geographic longitude in decimal degrees using WGS84 datum. Positive values are east of the Greenwich Meridian, negative values are west of it. Legal values lie between -180 and 180, inclusive. The desired minimum number of decimal places is the hundred-thousandth (0.00001) to achieve meter scale resolution.",M,Mandatory,"Mandatory unless specified under the term informationWithheld, or samp_category = negative control, positive control, or PCR standard",numeric,NA,NA,NA,-121.17611,NA,dwc,http://rs.tdwg.org/dwc/terms/decimalLongitude,description
sampleMetadata,Sample collection,decimalLatitude,"The geographic latitude in decimal degrees using WGS84 datum. Positive values are north of the Equator, negative values are south of it. Legal values lie between -90 and 90, inclusive. The desired minimum number of decimal places is the hundred-thousandth (0.00001) to achieve meter scale resolution.",M,Mandatory,"Mandatory unless specified under the term informationWithheld, or samp_category = negative control, positive control, or PCR standard",numeric,NA,NA,NA,-41.09834,NA,dwc,http://rs.tdwg.org/dwc/terms/decimalLatitude,description
sampleMetadata,Sample collection,verbatimLongitude,"The original longitude in any format (i.e. deg/min/sec, UTM) before converting to decimal degrees and WGS84. verbatimCoordinateSystem and verbatimGeodeticDatum should be stored as well.",O,Optional,NA,free text,NA,NA,NA,"121d 10' 34"" W",NA,dwc,http://rs.tdwg.org/dwc/terms/verbatimLongitude,description
sampleMetadata,Sample collection,verbatimLatitude,"The original latitude in any format (i.e. deg/min/sec, UTM) before converting to decimal degrees and WGS84. verbatimCoordinateSystem and verbatimGeodeticDatum should be stored as well.",O,Optional,NA,free text,NA,NA,NA,41 05 54.03S,NA,dwc,http://rs.tdwg.org/dwc/terms/verbatimLatitude,description
sampleMetadata,Sample collection,verbatimCoordinateSystem,The coordinate format of the verbatimLatitude and verbatimLongitude,O,Optional,NA,controlled vocabulary,NA,NA,decimal degrees | degrees minutes seconds | UTM | other:,degrees minutes seconds,NA,dwc,http://rs.tdwg.org/dwc/terms/verbatimCoordinateSystem,description | field_type
sampleMetadata,Sample collection,verbatimSRS,"The ellipsoid, geodetic datum, or spatial reference system (SRS) upon which coordinates given in verbatimLatitude and verbatimLongitude, or verbatimCoordinates are based.",O,Optional,NA,controlled vocabulary,NA,NA,WGS84 | NAD84 | NAD27 | GDA94 | GDA2020 | ETRS89 | JGD2000 | other:,NAD84,NA,dwc,http://rs.tdwg.org/dwc/terms/verbatimSRS,description | field_type
sampleMetadata,Sample collection,geo_loc_name,"The geographical origin of the sample as defined by the country or sea name followed by regions and localities. Country or sea names should be chosen from the INSDC Geographic Location Name List INSDC country list (http://insdc.org/country.html). Fixed format following <country or sea names>:<region>,<locality>. E.g., ""USA: Maryland, Bethesda"" , ""Atlantic Ocean:Charlie Gibbs Fracture Zone""",M,Mandatory,NA,fixed format,NA,"<country or sea names>:<region>,<locality>",NA,"USA: Maryland, Bethesda",NA,mixs,https://w3id.org/mixs/0000010,description
sampleMetadata,Sample collection,eventDate,"The date and time of sampling, either as an instance (single point in time) or interval. Must follow ISO 8601 format (yyyy-mm-ddThh:mm:ss). Time zone must be specified after the timestamp (e.g., ""2008-01-23T19:23-06:00"" in the time zone six hours earlier than UTC, ""2008-01-23T19:23Z"" at UTC time). In case no exact time is available, the date/time can be right truncated i.e. all of these are valid times: 2008-01-23T19:23:10+00:00; 2008-01-23T19:23:10Z; 2008-01-23; 2008-01; 2008; Except: 2008-01; 2008 all are ISO8601 compliant. A date and time range can be entered separated by a backslash ""/"" (e.g., 2008-01-23T19:23-06:00/2008-01-23T19:53-06:00)",M,Mandatory,NA,fixed format,NA,yyyy-mm-ddThh:mm:ss+-hh:mm,NA,2008-01-23T19:23-06:00,NA,dwc | mixs,http://rs.tdwg.org/dwc/terms/eventDate | https://w3id.org/mixs/0000011,description
sampleMetadata,Sample collection,eventDurationValue,"The duration of the sampling event, written in ISO 8601 format (i.e., P1DT3H for 1 day and 3 hours period. P1Y6M for 1 year and 6 months period. T30M/45M for some time between 30 and 45 minutes).",O,Optional,NA,fixed format,NA,PnYnMnWnDTnHnMnS,NA,T1H25M,NA,Humboldt ext,http://rs.tdwg.org/eco/terms/eventDurationValue,description | field_type
sampleMetadata,Sample collection,verbatimEventDate,Sample collection date before formatting,O,Optional,NA,free text,NA,NA,NA,23-January-2008,NA,dwc,http://rs.tdwg.org/dwc/terms/verbatimEventDate,description
sampleMetadata,Sample collection,verbatimEventTime,"Sample collection time before formatting to ISO 8601, or at the local time (if eventDate time samp has been converted to UTC time)",O,Optional,NA,free text,NA,NA,NA,10:23,NA,new,NA,Newly added
sampleMetadata,Sample collection,env_broad_scale,"Major environmental system your sample came from. The systems identified should have a coarse spatial grain, to provide the general environmental context of where the sampling was done. Select from ENVO’s biome class: http://purl.obolibrary.org/obo/ENVO_00000428. Examples include; estuarine biome [ENVO:01000020], tropical moist broadleaf forest biome [ENVO:01000228],",M,Mandatory,"Mandatory unless samp_category = negative control, positive control, or PCR standard",fixed format,NA,termLabel [termID],http://purl.obolibrary.org/obo/ENVO_00000428,estuarine biome [ENVO:01000020],NA,mixs | gbifDNAext,https://w3id.org/mixs/0000012,description | field_type
sampleMetadata,Sample collection,env_local_scale,"The entity or entities which are in your sample or specimen’s local vicinity and which you believe have significant causal influences on your sample. Select from ENVO's layer class: http://purl.obolibrary.org/obo/ENVO_01000281. Examples include;  marine pelagic zone [ENVO:00000208], estuarine coastal surface layer [ENVO:01001302], shrub layer [ENVO:01000336]",M,Mandatory,"Mandatory unless samp_category = negative control, positive control, or PCR standard",fixed format,NA,termLabel [termID],http://purl.obolibrary.org/obo/ENVO_01000281,estuarine coastal surface layer [ENVO:01001302],NA,mixs | gbifDNAext,https://w3id.org/mixs/0000013,description | field_type
sampleMetadata,Sample collection,env_medium,"Environmental material or materials (pipe separated) immediately surrounded your sample prior to sampling. Select from ENVO's environmental material class (entity/ continuant/ independent continuant/ material entity/ environmental material): http://purl.obolibrary.org/obo/ENVO_00010483. Examples include; soil [ENVO:00001998], marine sediment [ENVO:03000033], air [ENVO:00002005], sea water [ENVO:00002149], fresh water [ENVO:00002011], tap water [ENVO:00003096], fecal material [ENVO:00002003], digestive tract environment [ENVO:2100002], intestine environment [ENVO:2100002], planktonic material [ENVO:01000063]",M,Mandatory,"Mandatory unless samp_category = negative control, positive control, or PCR standard",fixed format,NA,termLabel [termID],http://purl.obolibrary.org/obo/ENVO_00010483,soil [ENVO:00001998],NA,mixs | gbifDNAext,https://w3id.org/mixs/0000014,description | field_type
sampleMetadata,Sample collection,habitat_natural_artificial_0_1,"Whether samples were taken from natural (0) or artificial (1) habitat. The examples of artificial habitat include mesocosm tank in lab, enclosure in zoo etc., including semi-natural systems. The definition of natural habitat is locations uncontrolled by researchers",R,Recommended,NA,Boolean,NA,NA,0 | 1,0.0,NA,thalinger2020,NA,NA
sampleMetadata,Sample collection,samp_collect_method,The method employed for collecting the sample. Provide a link to a paper/ handbook/ standard operation protocol if any.,R,Recommended,NA,free text,NA,NA,NA,https://research.csiro.au/ambsm/1-sample-collection-procedures/meth_1-2-soil-sampling-for-utas-urban-soil-and-aerial-microbiome-study/,ALL,mixs | gbifDNAext,https://w3id.org/mixs/0001225,description
sampleMetadata,Sample collection,samp_collect_device,"The device used to collect an environmental sample. This term accepts terms listed under environmental sampling device (https://ontobee.org/ontology/OBI?iri=http://purl.obolibrary.org/obo/OBI_0000968) such as syringe [OBI_0000422] and container [OBI_0000967] as well as free-text entry (i.e. niskin bottle, push core, spoon, water bottle).",R,Recommended,NA,free text,NA,NA,NA,push core,ALL,mixs | gbifDNAext,https://w3id.org/mixs/0000002,description
sampleMetadata,Sample collection,samp_size,"Amount or size of original sample (volume, mass or area) that was collected from the environment. Specify the unit under the term samp_size_unit. Note: the amount or size of (sub)sample processed for DNA extraction should be entered under the term samp_vol_we_dna_ext.",HR,Highly recommended,NA,numeric,Select from sampl_size_unit,NA,NA,5.0,ALL,mixs | gbifDNAext,https://w3id.org/mixs/0000001,description
sampleMetadata,Sample collection,samp_size_unit,Unit for samp_size,HR,Highly recommended,NA,controlled vocabulary,NA,NA,mL | L | mg | g | kg | cm2 | m2 | cm3 | m3 | other:,L,ALL,new,NA,Newly added
studyMetadata,Sample collection,biological_rep,The numbe of biological replicated collected at each sampling point and/or for each experimental treatment in the study.,R,Recommended,NA,integer,NA,NA,NA,3 | 4 | 5,NA,new,NA,NA
sampleMetadata,Sample storage,samp_store_temp,"Temperature at which the sample was stored. Enter either the fixed term ""ambient temperature"" or a numeric value. Note: If a sample was processed before DNA extraction (e.g., filtration, homogenisation, subsampling), enter the storage temperature before the process here, and the storage temperature of the processed sample (i.e., filter paper) under a term prepped_samp_store_temp.",HR,Highly recommended,NA,numeric or controlled vocabulary,degree Celsius,NA,numeric value | ambient temperature | other:,-80.0,ALL,mixs,https://w3id.org/mixs/0000110,description | field_type
sampleMetadata,Sample storage,samp_store_sol,"Solution within which the sample was stored. Note: If a asample was processed before DNA extraction (e.g., filtration, homogenisation, subsampling), enter the storage solution before the process here, and the storage solution of the processed sample under the term prepped_samp_store_sol.",HR,Highly recommended,NA,controlled vocabulary,NA,NA,ethanol | sodium acetate | longmire | lysis buffer | none | other:,none,ALL,mixs,https://w3id.org/mixs/0001317,description | field_type
sampleMetadata,Sample storage,samp_store_dur,"Duration for which the sample was stored prior to DNA extraction, written in ISO 8601 format (i.e., P14D for 14 days period. P1Y6M for 1 year and 6 months period. P1W/4W for some time between 1 and 4 weeks). Note: If a sample was processed before DNA extraction (e.g., filtration, homogenisation, subsampling), enter the storage duration before the process here, and the storage duration of the processed sample under the term prepped_samp_store_temp.",HR,Highly recommended,NA,fixed format,NA,PnYnMnWnDTnHnMnS,NA,P1Y6M,ALL,mixs,https://w3id.org/mixs/0000116,description
sampleMetadata,Sample storage,samp_store_loc,"Location at which sample was stored, usually name of a specific freezer/room",O,Optional,NA,free text,NA,NA,NA,"UWA, IOMRC, Lv4 -80Freezer1",NA,mixs,NA,https://w3id.org/mixs/0000755
sampleMetadata,Sample storage,dna_store_loc,"Location at which extracted DNA was stored, usually name of a specific freezer/room",O,Optional,NA,free text,NA,NA,NA,"UWA, IOMRC, Lv4 -80Freezer2",NA,new,NA,NA
sampleMetadata,Sample storage,samp_store_method_additional,"Additional information on sample storage method, that has not been shared in the given record.",O,Optional,NA,free text,NA,NA,NA,The sample was thawed overnight at room temperature prior to DNA extraction,ALL,new,NA,Newly added
sampleMetadata,Sample preparation,samp_mat_process,"Any processing applied to the sample during or after retrieving the sample from environment (i.e. sieving, filtration, precipitation, homogenising, subsampling).",R,Recommended,NA,free text,NA,NA,NA,"Water samples were pre-filtered using a sieve (200 micrometers), then filtered using a peristaltic pump (pore size 0.45 micrometers).",ALL,mixs | gbifDNAext,https://w3id.org/mixs/0000016,description
sampleMetadata,Sample preparation,filter_passive_active_0_1,"Whether water/ air samples were collected using active (i.e. pump, fan) or passive (i.e. submerged materials in water/air) filtration approach. Active = 1, Passive = 0",R,Recommended,NA,Boolean,NA,NA,0 | 1,1.0,Water | Air,new,NA,Newly added
sampleMetadata,Sample preparation,stationed_sample_dur,"Duration of on-site, stationed sampling (i.e., the filter deployment period). This term is recommended to be recorded when filters are deployed directly in the environment, such as during airborne eDNA sampling or when filters are submerged in water for a certain period). The duration should be recorded using ISO 8601 duration format (P<date>T<time>). For example, P1Y1M1DT1H1M1.1S represents 1 year, 1 month, 1 day, 1 hour, 1 minute, 1 second, and 100 milliseconds",R,Recommended,NA,fixed format,NA,PnYnMnWnDTnHnMnS,NA,T1H30M,Water | Air,new,NA,Newly added
sampleMetadata,Sample preparation,pump_flow_rate,Pump flow rate of filtration if applicable,O,Optional,NA,numeric,NA,NA,NA,0.2,Water | Air,new,NA,Newly added
sampleMetadata,Sample preparation,pump_flow_rate_unit,Unit for pump_flow_rate,O,Optional,NA,controlled vocabulary,NA,NA,m3/s | m3/min | m3/h | L/s | L/min | L/h | other:,m3/s,Water | Air,new,NA,Newly added
sampleMetadata,Sample preparation,prefilter_material,Matiral used to pre-filter/pre-sort the sample,O,Optional,NA,free text,NA,NA,NA,nylon,Water | Air,new,NA,Newly added
sampleMetadata,Sample preparation,size_frac_low,Refers to the mesh/pore size used to pre-filter/pre-sort the sample. Materials larger than the size threshold are excluded from the sample,HR,Highly recommended,NA,numeric,µm,NA,NA,20.0,Water | Air,mixs,https://w3id.org/mixs/0000735,field_type
sampleMetadata,Sample preparation,size_frac,Filtering pore size used in sample filtration,HR,Highly recommended,If filtration was applied,numeric,µm,NA,NA,0.22,Water | Air,mixs | gbifDNAext,https://w3id.org/mixs/0000017,NA
sampleMetadata,Sample preparation,filter_diameter,Diameter of a filter if circular,R,Recommended,NA,numeric,mm,NA,NA,47.0,Water | Air,thalinger2020,NA,NA
sampleMetadata,Sample preparation,filter_surface_area,Surface area of a filter,R,Recommended,NA,numeric,mm2,NA,NA,1734.94,Water | Air,thalinger2020,NA,NA
sampleMetadata,Sample preparation,filter_material,Material of filter,HR,Highly recommended,NA,controlled vocabulary,NA,NA,cellulose | cellulose ester | glass fiber | thermoplastic membrane | track etched polycarbonate | nylon | polyethersulfone| other:,cellulose ester,Water | Air,nmdc,https://w3id.org/nmdc/filter_material,description | field_type
sampleMetadata,Sample preparation,filter_name,Commercial names and brand of filter,R,Recommended,NA,free text,NA,NA,NA,Merck Sterivex,Water | Air,new,NA,NA
