data_type,section,term_name,description,requirement_level_code,requirement_level,requirement_level_condition,term_type,unit,fixed_format,controlled_vocabulary_options,example,sample_type_specificity,source,URI,modifications.made
studyMetadata,Bioinformatics,screen_contam_method,How were contaminations screened and applied in data curation/analyses/interpretation?,HR,Highly recommended,if screen_contam_0_1 is 1,free text,NA,NA,NA,"Taxa detected in negative controls were checked, and the read counts were applied as a cutoff to call presence.",NA,new,NA,Newly added
studyMetadata,Bioinformatics,screen_geograph_method,How were species distribution information screened and applied?,R,Recommended,if screen_geograph_0_1 is 1,free text,NA,NA,NA,"Distribution information was checked using FishBase, and species that did not reside in the study area were removed.",NA,new,NA,Newly added
studyMetadata,Bioinformatics,screen_nontarget_method,How were non-target species screened and applied?,R,Recommended,if screen_nontarget_0_1 is 1,free text,NA,NA,NA,"Non-targeted species (i.e. domestic animals, humans and non-marine species) were removed from the curated OTU table and downstream data analyses. OTUs that were assigned to species in WoRMS were kept in the curated OTU table.",NA,new,NA,Newly added
studyMetadata,Bioinformatics,screen_other,Description of other screening criteria and approaches,R,Recommended,NA,free text,NA,NA,NA,NEED AN EXAMPLE HERE,NA,new,NA,Newly added
studyMetadata,Bioinformatics,otu_raw_description,A description of the data curation and processing steps applied to the raw OTU/ASV table,R,Recommended,NA,free text,NA,NA,NA,OTU clustering with 97% similarity,NA,new,NA,Newly added
studyMetadata,Bioinformatics,otu_final_description,A description of the data curation and processing steps applied to the final OTU/ASV table,R,Recommended,NA,free text,NA,NA,NA,Removal of ASVs that were assigned to non-targeted species. Removal of control samples.,NA,new,NA,Newly added
studyMetadata,Bioinformatics,bioinfo_method_additional,"Additional information on bioinformatics, that has not been shared in the given record.",O,Optional,NA,free text,NA,NA,NA,"The min_reads_cutoff was 1 read, but singletons were kept if the same sequence was detected in multiple samples. Data was curated using r-package LULU, minimum_mismatch cutoff 90%",NA,new,NA,Newly added
experimentRunMetadata,Bioinformatics,input_read_count,The total number of raw sequence reads for each sample,R,Recommended,NA,integer,reads,NA,NA,20485.0,NA,nmdc,https://w3id.org/nmdc/input_read_count,description
experimentRunMetadata,Bioinformatics,output_read_count,"The number of filtered sequence reads for each sample, that made it through bioinforamtic filtering and used for final/subsequent analyses",R,Recommended,NA,integer,reads,NA,NA,16847.0,NA,nmdc,https://w3id.org/nmdc/output_read_count,description
experimentRunMetadata,Bioinformatics,output_otu_num,Total numbe of OTUs or ASVs for each sample,R,Recommended,NA,integer,NA,NA,NA,86.0,NA,new,NA,new
experimentRunMetadata,Bioinformatics,otu_num_tax_assigned,Total number of OTUs or ASVs assigned to taxa based on the study-specific thresholds for each sample,R,Recommended,NA,integer,NA,NA,NA,49.0,NA,new,NA,new
taxaRaw | taxaFinal,OTU/ASV,seq_id,Query sequence ID. Must be unique within the dataset,M,Mandatory,NA,free text,NA,NA,NA,ASV1,NA,new,NA,Newly added
taxaRaw | taxaFinal,OTU/ASV,dna_sequence,The DNA sequence,M,Mandatory,NA,free text,NA,NA,NA,GGTGTTTAAATTTCGGTCTGTAAGAAGTATTGTAATCCCAGCCGCTAGGACTGGAAGGGAAAGAAGGAGAAGGACAGCTGTAATTAGCACGGCTCAGACAAACAAGGGTGTCTGGTATTGGGAAATAGCTGGGGGTTTCATGTTAATAATTGTGGTAATAAAATTGATAGCACCAAGGATTGAAGAGACCCCGGCTAGGTGGAGAGAA,NA,gbifDNAext,https://rs.gbif.org/extension/gbif/1.0/dna_derived_data_2022-02-23.xml,NA
taxaRaw | taxaFinal,OTU/ASV,kingdom,The full scientific name of the kingdom,R,Recommended,NA,free text,NA,NA,NA,Animalia,NA,dwc,http://rs.tdwg.org/dwc/terms/kingdom,description
taxaRaw | taxaFinal,OTU/ASV,phylum,The full scientific name of the phylum or division,R,Recommended,NA,free text,NA,NA,NA,Chordata,NA,dwc,http://rs.tdwg.org/dwc/terms/phylum,description
taxaRaw | taxaFinal,OTU/ASV,class,The full scientific name of the class,R,Recommended,NA,free text,NA,NA,NA,Actinopterygii,NA,dwc,http://rs.tdwg.org/dwc/terms/class,description
taxaRaw | taxaFinal,OTU/ASV,order,The full scientific name of the order,R,Recommended,NA,free text,NA,NA,NA,Perciformes,NA,dwc,http://rs.tdwg.org/dwc/terms/order,description
taxaRaw | taxaFinal,OTU/ASV,family,The full scientific name of the family,R,Recommended,NA,free text,NA,NA,NA,Lutjanidae,NA,dwc,http://rs.tdwg.org/dwc/terms/family,description
taxaRaw | taxaFinal,OTU/ASV,genus,The full scientific name of the genus,R,Recommended,NA,free text,NA,NA,NA,Lutjanus,NA,dwc,http://rs.tdwg.org/dwc/terms/genus,description
taxaRaw | taxaFinal,OTU/ASV,specificEpithet,The name of the first or species epithet of the scientificName.,R,Recommended,NA,free text,NA,NA,NA,erythropterus,NA,dwc,http://rs.tdwg.org/dwc/terms/specificEpithet,description
taxaRaw | taxaFinal,OTU/ASV,scientificName,The full scientific name of the genus and species,HR,Highly recommended,NA,free text,NA,NA,NA,Lutjanus erythropterus,NA,dwc,http://rs.tdwg.org/dwc/terms/scientificName,description
taxaRaw | taxaFinal,OTU/ASV,scientificNameAuthorship,The authorship information for the scientificName,R,Recommended,NA,free text,NA,NA,NA,"Bloch, 1790",NA,dwc,http://rs.tdwg.org/dwc/terms/scientificNameAuthorship,description
taxaRaw | taxaFinal,OTU/ASV,taxonRank,The taxonomic rank of the most specific name in the scientificName,HR,Highly recommended,NA,controlled vocabulary,NA,NA,kingdom | phylum | class | order | family | genus | species | other:,genus,NA,dwc,http://rs.tdwg.org/dwc/terms/taxonRank,NA
taxaRaw | taxaFinal,OTU/ASV,taxonID,An identifier for the assigned taxon (or taxa in the case of mutliple hits). May be a global unique identifier or an identifier specific to the data set.,HR,Highly recommended,NA,free text,NA,NA,NA,218797.0,NA,dwc,http://rs.tdwg.org/dwc/terms/taxonID,description
taxaRaw | taxaFinal,OTU/ASV,taxonID_db,The taxonomy database correspoingind to taxonID.,HR,Highly recommended,NA,free text,NA,NA,NA,NCBI,NA,new,NA,NA
taxaRaw | taxaFinal,OTU/ASV,verbatimIdentification,A string representing the taxonomic identification as it appeared in the original record (i.e. the database used such as NCBI). This could be the identification,O,Optional,NA,free text,NA,NA,NA,Eukaryota; Metazoa; Chordata; Actinopterygii; Perciformes; Lutjanidae; Lutjanus; Lutjanus_erythropterus,NA,dwc,http://rs.tdwg.org/dwc/terms/verbatimIdentification,description
taxaRaw | taxaFinal,OTU/ASV,accession_id,Accession ID of the best matching sequence from a reference database,R,Recommended,NA,free text,NA,NA,NA,MG002616.1,NA,new,NA,NA
taxaRaw | taxaFinal,OTU/ASV,accession_id_ref_db,Reference database (i.e. sequences not generated as part of the current study) of the best matching sequence (accesssion_id),R,Recommended,NA,free text,NA,NA,NA,NCBI,NA,mixs | gbifDNAext,https://w3id.org/mixs/0000087,field_name | description
taxaRaw | taxaFinal,OTU/ASV,percent_match,"The percentage of sequence identity between a query sequence obtained from eDNA and a reference sequence in a database. If multiple speices were assigned to one ASV/OTU, a range can be entered separated by a backslash ""/"" (e.g., 98.7/99.2)",R,Recommended,NA,numeric,%,NA,NA,99.8,NA,new,NA,Newly added
taxaRaw | taxaFinal,OTU/ASV,percent_query_cover,"The percentage coverage of the query sequence that aligns with a reference sequence in a database. If multiple speices were assigned to one ASV/OTU, a range can be entered separated by a backslash ""/"" (e.g., 98.7/99.2)",R,Recommended,NA,numeric,%,NA,NA,100.0,NA,new,NA,Newly added
taxaRaw | taxaFinal,OTU/ASV,confidence_score,"Confidence score for the taxonomic assignment, such as from bootstrapping. If multiple speices were assigned to one ASV/OTU, a range can be entered separated by a backslash ""/"" (e.g., 0.996/0.998)",R,Recommended,NA,numeric,NA,NA,NA,0.997,NA,new,NA,Newly added
taxaRaw | taxaFinal,OTU/ASV,identificationRemarks,Comments or notes about the taxonomic assignment.,O,Optional,NA,free text,NA,NA,NA,NEED AN EXAMPLE HERE,NA,dwc,http://rs.tdwg.org/dwc/terms/identificationRemarks,description
sampleMetadata,Environment,samp_weather,The weather on the sampling day,O,Optional,NA,free text,NA,NA,NA,foggy,ALL,mixs,https://w3id.org/mixs/0000827,NA
sampleMetadata,Environment,minimumDepthInMeters,"The lesser depth of a range of depth (vertical distance below the local surface) at which a sample was collected. For sediment or soil samples depth is measured from sediment or soil surface, respectively. If there is only one single point of depth (no range), the values in minimumDepthInMeters and maximumDepthInMeters are the same.",R,Recommended,NA,numeric,meter,NA,NA,0.2,Water | Soil | Sediment | HostAssociated | MicrobialMatBiofilm | SymbiontAssociated,dwc,http://rs.tdwg.org/dwc/terms/minimumDepthInMeters,description
sampleMetadata,Environment,maximumDepthInMeters,"The greater depth of a range of depth (vertical distance below the local surface) at which a sample was collected. For sediment or soil samples depth is measured from sediment or soil surface, respectively. If there is only one single point of depth (no range), the values in minimumDepthInMeters and maximumDepthInMeters are the same.",R,Recommended,NA,numeric,meter,NA,NA,0.2,Water | Soil | Sediment | HostAssociated | MicrobialMatBiofilm | SymbiontAssociated,dwc,http://rs.tdwg.org/dwc/terms/maximumDepthInMeters,description
sampleMetadata,Environment,tot_depth_water_col,"Measurement of total depth of water column. For example, if a sea surface water sample was collected at a sampling site where the water depth was 15m, enter 15 here and 0 under the terms minimumDepthInMeters and maximumDepthInMeters.",R,Recommended,NA,numeric,meter,NA,NA,15.0,Water | Sediment | HostAssociated | MicrobialMatBiofilm | SymbiontAssociated,mixs,https://w3id.org/mixs/0000634,description
sampleMetadata,Environment,elev,"Elevation of the sampling site is its height above a fixed reference point, most commonly the mean sea level. Elevation is mainly used when referring to points on the earth's surface, while altitude is used for points above the surface, such as an aircraft in flight or a spacecraft in orbit. i.e. 0m for seawater sample",O,Optional,NA,numeric,meter,NA,NA,100.0,ALL,mixs,https://w3id.org/mixs/0000093,description
sampleMetadata,Environment,alt,"Heights of objects such as airplanes, space shuttles, rockets, atmospheric balloons and heights of places such as atmospheric layers and clouds. It is used to measure the height of an object which is above the earth's surface. In this context, the altitude measurement is the vertical distance between the earth's surface above sea level and the sampled position in the air",O,Optional,NA,numeric,meter,NA,NA,100.0,Air | HostAssociated,mixs,https://w3id.org/mixs/0000094,NA
sampleMetadata,Environment,temp,Temperature of the sample at the time of sampling in degree Celsius,O,Optional,NA,numeric,degree Celsius,NA,NA,25.0,ALL,mixs,https://w3id.org/mixs/0000113,NA
sampleMetadata,Environment,chlorophyll,Concentration of chlorophyll,O,Optional,NA,numeric,mg/m3,NA,NA,5.0,Water | Soil | Sediment | MicrobialMatBiofilm,mixs,https://w3id.org/mixs/0000177,NA
sampleMetadata,Environment,light_intensity,Measurement of light intensity,O,Optional,NA,numeric,lux,NA,NA,0.3,Water | Soil | Sediment | Air | MicrobialMatBiofilm | SymbiontAssociated,mixs,https://w3id.org/mixs/0000706,NA
sampleMetadata,Environment,ph,"Ph measurement of the sample, or liquid portion of sample, or aqueous phase of the fluid",O,Optional,NA,numeric,no unit,NA,NA,7.2,Water | Soil | Sediment | MicrobialMatBiofilm,mixs,https://w3id.org/mixs/0001001,NA
sampleMetadata,Environment,ph_meth,Reference or method used in determining pH,O,Optional,NA,free text,NA,NA,NA,https://www.epa.gov/sites/default/files/2015-12/documents/9040c.pdf,Water | Soil | Sediment | MicrobialMatBiofilm,mixs,https://w3id.org/mixs/0001106,NA
sampleMetadata,Environment,salinity,"The total concentration of all dissolved salts in a liquid or solid sample. While salinity can be measured by a complete chemical analysis, this method is difficult and time consuming. More often, it is instead derived from the conductivity measurement. This is known as practical salinity. These derivations compare the specific conductance of the sample to a salinity standard such as seawater",O,Optional,NA,numeric,partical salinity unit (psu),NA,NA,25.0,Water | Sediment | HostAssociated | MicrobialMatBiofilm | SymbiontAssociated,mixs,https://w3id.org/mixs/0000183,NA
sampleMetadata,Environment,suspend_part_matter,Concentration of suspended particulate matter,O,Optional,NA,numeric,mg/L,NA,NA,0.5,Water,mixs,https://w3id.org/mixs/0000741,NA
sampleMetadata,Environment,tidal_stage,Stage of tide,O,Optional,NA,free text,NA,NA,NA,high tide,Water | Sediment,mixs,https://w3id.org/mixs/0000750,NA
sampleMetadata,Environment,turbidity,Measure of the amount of cloudiness or haziness in water caused by individual particles,O,Optional,NA,numeric,nephelometric turbidity unit (ntu),NA,NA,0.3,Water | Sediment | MicrobialMatBiofilm,mixs,https://w3id.org/mixs/0000191,NA
sampleMetadata,Environment,water_current,Measurement of magnitude and direction of flow within a fluid,O,Optional,NA,numeric,m/s,NA,NA,10.0,Water | Sediment,mixs,https://w3id.org/mixs/0000203,NA
sampleMetadata,Environment,humidity,"Amount of water vapour in the air, at the time of sampling relative to the maximum amount of water vapor the air can hold at a given temperature and pressure. Also known as relative humidity.",O,Optional,NA,numeric,%,NA,NA,61.0,Air,mixs,https://w3id.org/mixs/0000100,description
sampleMetadata,Environment,solar_irradiance,"Description and/or the amount of solar energy that arrives at a specific area of a surface at the time of sampling. i.e. fully exposed, partially shaded,cloud cover 20%, 1.36kW/m2/day",O,Optional,NA,free text,NA,NA,NA,1.36 kw/m2/day,Water | Soil | Sediment | Air,mixs,https://w3id.org/mixs/0000112,description
sampleMetadata,Environment,wind_direction,Wind direction (the direction from which a wind originates) at the time of sampling,O,Optional,NA,free text,NA,NA,NA,NW,Water | Soil | Sediment | Air,mixs,https://w3id.org/mixs/0000757,description
sampleMetadata,Environment,wind_speed,Speed of wind measured at the time of sampling,O,Optional,NA,numeric,m/s,NA,NA,5.14,Water | Soil | Sediment | Air,mixs,https://w3id.org/mixs/0000118,NA
sampleMetadata,Environment,host_species,The scientific name of host species. i.e. predator species where a gut content sample was dissected from,O,Optional,NA,free text,NA,NA,NA,Lutjanus erythropterus,HostAssociated | SymbiontAssociated,mixs,https://w3id.org/mixs/0000248,field_name | description
sampleMetadata,Environment,host_life_stage,Description of life stage of host. Select from UBERON's life cycle class (http://purl.obolibrary.org/obo/UBERON_0000104),O,Optional,NA,fixed format,NA,termLabel [termID],http://purl.obolibrary.org/obo/UBERON_0000104,juvenile stage [UBERON_0034919],HostAssociated | SymbiontAssociated,mixs,https://w3id.org/mixs/0000251,description | field_type
sampleMetadata,Environment,host_tot_mass,"Total mass of the host at collection, the unit depends on host.",O,Optional,NA,numeric,NA,NA,NA,58.0,HostAssociated | SymbiontAssociated,mixs,https://w3id.org/mixs/0000263,NA
sampleMetadata,Environment,host_tot_mass_unit,The unit of host_tot_mass,O,Optional,NA,controlled vocabulary,NA,NA,mg | g | kg | other:,g,HostAssociated | SymbiontAssociated,new,NA,Newly added
sampleMetadata,Environment,host_height,The height of subject,O,Optional,NA,numeric,NA,NA,NA,135.0,HostAssociated | SymbiontAssociated,mixs,https://w3id.org/mixs/0000264,NA
sampleMetadata,Environment,host_height_unit,The unit of host_height,O,Optional,NA,controlled vocabulary,NA,NA,mm | cm | m | other:,cm,HostAssociated | SymbiontAssociated,new,NA,Newly added
sampleMetadata,Environment,host_length,The length of subject,O,Optional,NA,numeric,NA,NA,NA,54.0,HostAssociated | SymbiontAssociated,mixs,https://w3id.org/mixs/0000256,NA
sampleMetadata,Environment,host_length_unit,The unit of host_length,O,Optional,NA,controlled vocabulary,NA,NA,mm | cm | m | other:,mm,HostAssociated | SymbiontAssociated,new,NA,Newly added
sampleMetadata,Environment,diss_inorg_carb,"Dissolved inorganic carbon concentration in the sample, typically measured after filtering the sample using a 0.45 micrometre filter",O,Optional,NA,numeric,NA,NA,NA,2059.0,Water | Soil | Sediment | Air | MicrobialMatBiofilm,mixs,https://w3id.org/mixs/0000434,NA
sampleMetadata,Environment,diss_inorg_carb_unit,The unit of diss_inorg_carb,O,Optional,NA,controlled vocabulary,NA,NA,µM | mol/m3 | mmol/m3 | µmol/m3 | mol/L | mmol/L | µmol/L | mg/L | µg/L |  µmol/kg | mmol/kg | parts per million | other:,mmol/kg,Water | Soil | Sediment | Air | MicrobialMatBiofilm,new,NA,Newly added
sampleMetadata,Environment,diss_inorg_nitro,Concentration of dissolved inorganic nitrogen,O,Optional,NA,numeric,NA,NA,NA,761.0,Water | Soil | Sediment | Air | MicrobialMatBiofilm,mixs,https://w3id.org/mixs/0000698,NA
sampleMetadata,Environment,diss_inorg_nitro_unit,The unit of diss_inorg_nitro,O,Optional,NA,controlled vocabulary,NA,NA,µM | mol/m3 | mmol/m3 | µmol/m3 | mol/L | mmol/L | µmol/L | mg/L | µg/L |  µmol/kg | mmol/kg | parts per million | other:,µmol/L,Water | Soil | Sediment | Air | MicrobialMatBiofilm,new,NA,Newly added
sampleMetadata,Environment,diss_org_carb,"Concentration of dissolved organic carbon in the sample, liquid portion of the sample, or aqueous phase of the fluid",O,Optional,NA,numeric,NA,NA,NA,197.0,Water | Soil | Sediment | Air | MicrobialMatBiofilm,mixs,https://w3id.org/mixs/0000433,NA
sampleMetadata,Environment,diss_org_carb_unit,The unit of diss_org_carb,O,Optional,NA,controlled vocabulary,NA,NA,µM | mol/m3 | mmol/m3 | µmol/m3 | mol/L | mmol/L | µmol/L | mg/L | µg/L |  µmol/kg | mmol/kg | parts per million | other:,µmol/L,Water | Soil | Sediment | Air | MicrobialMatBiofilm,new,NA,Newly added
sampleMetadata,Environment,diss_org_nitro,Dissolved organic nitrogen concentration measured as; total dissolved nitrogen - NH4 - NO3 - NO2,O,Optional,NA,numeric,NA,NA,NA,0.05,Water | Soil | Sediment | Air | MicrobialMatBiofilm,mixs,https://w3id.org/mixs/0000162,NA
sampleMetadata,Environment,diss_org_nitro_unit,The unit of diss_org_nitro,O,Optional,NA,controlled vocabulary,NA,NA,µM | mol/m3 | mmol/m3 | µmol/m3 | mol/L | mmol/L | µmol/L | mg/L | µg/L |  µmol/kg | mmol/kg | parts per million | other:,µmol/L,Water | Soil | Sediment | Air | MicrobialMatBiofilm,new,NA,Newly added
sampleMetadata,Environment,diss_oxygen,Concentration of dissolved oxygen,O,Optional,NA,numeric,NA,NA,NA,175.0,Water | Soil | Sediment | Air | MicrobialMatBiofilm,mixs,https://w3id.org/mixs/0000119,NA
sampleMetadata,Environment,diss_oxygen_unit,The unit of diss_oxygen,O,Optional,NA,controlled vocabulary,NA,NA,mg/L | µg/L | µM | mol/m3 | mmol/m3 | µmol/m3 | mol/L | mmol/L | µmol/L | mg/L | µg/L | mL/L | mmol/kg | parts per million | other:,mmol/kg,Water | Soil | Sediment | Air | MicrobialMatBiofilm,new,NA,Newly added
sampleMetadata,Environment,tot_diss_nitro,"Total dissolved nitrogen concentration, reported as nitrogen, measured by: total dissolved nitrogen = NH4 + NO3NO2 + dissolved organic nitrogen",O,Optional,NA,numeric,NA,NA,NA,40.0,Water | Soil | Sediment | Air | MicrobialMatBiofilm,mixs,https://w3id.org/mixs/0000744,NA
sampleMetadata,Environment,tot_diss_nitro_unit,The unit of tot_diss_nitro,O,Optional,NA,controlled vocabulary,NA,NA,µM | mol/m3 | mmol/m3 | µmol/m3 | mol/L | mmol/L | µmol/L | mg/L | µg/L |  µmol/kg | mmol/kg | parts per million | other:,µg/L,Water | Soil | Sediment | Air | MicrobialMatBiofilm,new,NA,Newly added
sampleMetadata,Environment,tot_inorg_nitro,Total inorganic nitrogen content,O,Optional,NA,numeric,NA,NA,NA,40.0,Water | Soil | Sediment | Air | MicrobialMatBiofilm,mixs,https://w3id.org/mixs/0000745,NA
sampleMetadata,Environment,tot_inorg_nitro_unit,The unit of tot_inorg_nitro,O,Optional,NA,controlled vocabulary,NA,NA,µM | mol/m3 | mmol/m3 | µmol/m3 | mol/L | mmol/L | µmol/L | mg/L | µg/L |  µmol/kg | mmol/kg | parts per million | other:,µg/L,Water | Soil | Sediment | Air | MicrobialMatBiofilm,new,NA,Newly added
sampleMetadata,Environment,tot_nitro,"Total nitrogen concentration of water samples, calculated by: total nitrogen = total dissolved nitrogen + particulate nitrogen. Can also be measured without filtering, reported as nitrogen",O,Optional,NA,numeric,NA,NA,NA,50.0,Water | Soil | Sediment | Air | MicrobialMatBiofilm,mixs,https://w3id.org/mixs/0000102,NA
sampleMetadata,Environment,tot_nitro_unit,The unit of tot_nitro,O,Optional,NA,controlled vocabulary,NA,NA,µM | mol/m3 | mmol/m3 | µmol/m3 | mol/L | mmol/L | µmol/L | mg/L | µg/L |  µmol/kg | mmol/kg | parts per million | other:,µmol/L,Water | Soil | Sediment | Air | MicrobialMatBiofilm,new,NA,Newly added
sampleMetadata,Environment,tot_part_carb,Total particulate carbon content,O,Optional,NA,numeric,NA,NA,NA,35.0,Water | Soil | Sediment | Air | MicrobialMatBiofilm,mixs,https://w3id.org/mixs/0000747,NA
sampleMetadata,Environment,tot_part_carb_unit,The unit of tot_part_carb,O,Optional,NA,controlled vocabulary,NA,NA,µM | mol/m3 | mmol/m3 | µmol/m3 | mol/L | mmol/L | µmol/L | mg/L | µg/L |  µmol/kg | mmol/kg | parts per million | other:,µmol/L,Water | Soil | Sediment | Air | MicrobialMatBiofilm,new,NA,Newly added
sampleMetadata,Environment,tot_org_carb,Total organic carbon content,O,Optional,NA,numeric,NA,NA,NA,0.02,Water | Soil | Sediment | Air | MicrobialMatBiofilm,mixs,https://w3id.org/mixs/0000533,NA
sampleMetadata,Environment,tot_org_carb_unit,The unit of tot_org_carb,O,Optional,NA,controlled vocabulary,NA,NA,µM | mol/m3 | mmol/m3 | µmol/m3 | mol/L | mmol/L | µmol/L | mg/L | µg/L |  µmol/kg | mmol/kg | parts per million | other:,other:gram Carbon per kg sample material,Water | Soil | Sediment | Air | MicrobialMatBiofilm,new,NA,Newly added
sampleMetadata,Environment,tot_org_c_meth,Reference or method used in determining total organic carbon,O,Optional,NA,free text,NA,NA,NA,https://www.epa.gov/sites/default/files/2015-12/documents/9060a.pdf,Water | Soil | Sediment | Air | MicrobialMatBiofilm,mixs,https://w3id.org/mixs/0000337,NA
sampleMetadata,Environment,tot_nitro_content,Total nitrogen content of the sample,O,Optional,NA,numeric,NA,NA,NA,35.0,Water | Soil | Sediment | Air | MicrobialMatBiofilm,mixs,https://w3id.org/mixs/0000530,NA
sampleMetadata,Environment,tot_nitro_content_unit,The unit of tot_nitro_content,O,Optional,NA,controlled vocabulary,NA,NA,µM | mol/m3 | mmol/m3 | µmol/m3 | mol/L | mmol/L | µmol/L | mg/L | µg/L |  µmol/kg | mmol/kg | parts per million | other:,other:mg N/kg of soil,Water | Soil | Sediment | Air | MicrobialMatBiofilm,new,NA,Newly added
sampleMetadata,Environment,tot_nitro_cont_meth,Reference or method used in determining the total nitrogen,O,Optional,NA,free text,NA,NA,NA,https://currentprotocols.onlinelibrary.wiley.com/doi/abs/10.1002/0471142913.fab0102s00,Water | Soil | Sediment | Air | MicrobialMatBiofilm,mixs,https://w3id.org/mixs/0000338,NA
sampleMetadata,Environment,tot_carb,Total carbon content,O,Optional,NA,numeric,NA,NA,NA,1.5,Water | Soil | Sediment | Air | MicrobialMatBiofilm,mixs,https://w3id.org/mixs/0000525,NA
sampleMetadata,Environment,tot_carb_unit,The unit of tot_carb,O,Optional,NA,controlled vocabulary,NA,NA,µM | mol/m3 | mmol/m3 | µmol/m3 | mol/L | mmol/L | µmol/L | mg/L | µg/L |  µmol/kg | mmol/kg | parts per million | other:,µg/L,Water | Soil | Sediment | Air | MicrobialMatBiofilm,new,NA,Newly added
sampleMetadata,Environment,part_org_carb,Concentration of particulate organic carbon,O,Optional,NA,numeric,NA,NA,NA,1.92,Water | Soil | Sediment | Air | MicrobialMatBiofilm,mixs,https://w3id.org/mixs/0000515,NA
sampleMetadata,Environment,part_org_carb_unit,The unit of part_org_carb,O,Optional,NA,controlled vocabulary,NA,NA,µM | mol/m3 | mmol/m3 | µmol/m3 | mol/L | mmol/L | µmol/L | mg/L | µg/L |  µmol/kg | mmol/kg | parts per million | other:,µmol/L,Water | Soil | Sediment | Air | MicrobialMatBiofilm,new,NA,Newly added
sampleMetadata,Environment,part_org_nitro,Concentration of particulate organic nitrogen,O,Optional,NA,numeric,NA,NA,NA,0.3,Water | Soil | Sediment | Air | MicrobialMatBiofilm,mixs,https://w3id.org/mixs/0000719,NA
sampleMetadata,Environment,part_org_nitro_unit,The unit of part_org_nitro,O,Optional,NA,controlled vocabulary,NA,NA,µM | mol/m3 | mmol/m3 | µmol/m3 | mol/L | mmol/L | µmol/L | mg/L | µg/L |  µmol/kg | mmol/kg | parts per million | other:,µmol/L,Water | Soil | Sediment | Air | MicrobialMatBiofilm,new,NA,Newly added
sampleMetadata,Environment,nitrate,Concentration of nitrate in the sample,O,Optional,NA,numeric,NA,NA,NA,65.0,Water | Soil | Sediment | Air | MicrobialMatBiofilm,mixs,https://w3id.org/mixs/0000425,NA
sampleMetadata,Environment,nitrate_unit,The unit of nitrate,O,Optional,NA,controlled vocabulary,NA,NA,µM | mol/m3 | mmol/m3 | µmol/m3 | mol/L | mmol/L | µmol/L | mg/L | µg/L |  µmol/kg | mmol/kg | parts per million | other:,µmol/L,Water | Soil | Sediment | Air | MicrobialMatBiofilm,new,NA,Newly added
sampleMetadata,Environment,nitrite,Concentration of nitrite in the sample,O,Optional,NA,numeric,NA,NA,NA,0.5,Water | Soil | Sediment | Air | MicrobialMatBiofilm,mixs,https://w3id.org/mixs/0000426,NA
sampleMetadata,Environment,nitrite_unit,The unit of nitrite,O,Optional,NA,controlled vocabulary,NA,NA,µM | mol/m3 | mmol/m3 | µmol/m3 | mol/L | mmol/L | µmol/L | mg/L | µg/L |  µmol/kg | mmol/kg | parts per million | other:,µmol/L,Water | Soil | Sediment | Air | MicrobialMatBiofilm,new,NA,Newly added
