data_type,section,term_name,description,requirement_level_code,requirement_level,requirement_level_condition,term_type,unit,fixed_format,controlled_vocabulary_options,example,sample_type_specificity,source,URI,modifications.made
studyMetadata,Targeted taxon detection,loq_method,"Method used for determining LOQ e.g., DOI of a published procedure",R,Recommended,NA,free text,NA,NA,NA,DOI: 10.1002/edn3.220,NA,new,NA,NA
studyMetadata,Targeted taxon detection,pcr_assay_loq_techreps,The number of technical replicates that the LOQ is applied to. See DOI: 10.1002/edn3.220,R,Recommended,NA,integer,NA,NA,NA,8.0,NA,new,NA,NA
studyMetadata,Targeted taxon detection,pcr_assay_loq,Assay's limit of quantification (LOQ) (the lowest amount of target taxon DNA that can be quantitatively determined with a stated precision under the stated experimental conditions).,M,Mandatory,If assay_type = targeted & pcr_0_1 = 1,numeric,NA,NA,NA,184.0,NA,gbifDNAext | MIQE,https://rs.gbif.org/extension/gbif/1.0/dna_derived_data_2022-02-23.xml,field_name | description
studyMetadata,Targeted taxon detection,pcr_assay_loq_unit,unit for pcr_assay_loq,M,Mandatory,If assay_type = targeted & pcr_0_1 = 1,controlled vocabulary,NA,NA,copies/reaction | copies/µL | ng/reaction | ng/µL | other:,ng/µL,NA,new,NA,NA
studyMetadata,Targeted taxon detection,pcr_assay_loq_UL,Upper 95% confidence limit for LOQ for a given number of technical replicates. See DOI: 10.1002/edn3.220,R,Recommended,NA,numeric,same as pcr_assay_loq_unit,NA,NA,NA,NA,new,NA,NA
studyMetadata,Targeted taxon detection,pcr_assay_loq_LL,Lower 95% confidence limit for LOQ for a given number of technical replicates. See DOI: 10.1002/edn3.220,R,Recommended,NA,numeric,same as pcr_assay_loq_unit,NA,NA,NA,NA,new,NA,NA
studyMetadata,Targeted taxon detection,std_type,The type of standard used for standard curves,R,Recommended,NA,controlled vocabulary,NA,NA,synthetic double-stranded DNA | plasmid | amplicon | gDNA | other:,synthetic double-stranded DNA,NA,new,NA,NA
studyMetadata,Targeted taxon detection,std_source,The source of standard used for standard curves,O,Optional,NA,free text,NA,NA,NA,ThermoFisher,NA,new,NA,NA
studyMetadata,Targeted taxon detection,std_seq,DNA sequences of standard,R,Recommended,NA,free text,NA,NA,NA,GTCTCTCCCTGTATATCGTCATGACATCTTCAGCCTTCCTCACATTAAAAACCAACAACTCTTTAACCATCAATACTCTCGCAACTTCATGAACTAAATCCCGACCCTTGCCGCATTAACCGCTCT,NA,new,NA,NA
studyMetadata,Targeted taxon detection,thresholdQuantificationCycle,Threshold for change in fluorescence signal between cycles,M,Mandatory,If assay_type = targeted & amp_vis_method = qPCR,numeric,No unit,NA,NA,0.3,NA,gbifDNAext | MIQE,https://rs.gbif.org/extension/gbif/1.0/dna_derived_data_2022-02-23.xml,NA
studyMetadata,Targeted taxon detection,baselineValue,The number of cycles when fluorescence signal from the target amplification is below background fluorescence not originated from the real target amplification.,O,Optional,NA,integer,cycle,NA,NA,15.0,NA,gbifDNAext | MIQE,https://rs.gbif.org/extension/gbif/1.0/dna_derived_data_2022-02-23.xml,NA
studyMetadata,Targeted taxon detection,automaticThresholdQuantificationCycle,Whether the threshold was set by the instrument (1) or manually (0).,O,Optional,NA,Boolean,NA,NA,0 | 1,1.0,NA,gbifDNAext | MIQE,https://rs.gbif.org/extension/gbif/1.0/dna_derived_data_2022-02-23.xml,description | field_type
studyMetadata,Targeted taxon detection,automaticBaselineValue,Whether the baseline value was set by the instrument (1) or manually (0).,O,Optional,NA,Boolean,NA,NA,0 | 1,1.0,NA,gbifDNAext | MIQE,https://rs.gbif.org/extension/gbif/1.0/dna_derived_data_2022-02-23.xml,description | field_type
stdData,Targeted taxon detection,std_conc,Input quantity of qPCR standard DNA,M,Mandatory,if samp_category = PCR standard,numeric,NA,NA,NA,2500.0,NA,new,NA,NA
stdData,Targeted taxon detection,std_conc_unit,Unit for input quantity of qPCR standard DNA,M,Mandatory,if samp_category = PCR standard,controlled vocabulary,NA,NA,copies/reaction | copies/µL of DNA extract | copies/µL of reaction | ng/reaction | ng/µL of DNA extract | ng/µL of reaction | other:,NA,NA,new,NA,NA
ampData | stdData,Targeted taxon detection,quantificationCycle,"The number of cycles required for the fluorescent signal to cross a given value threshold above the baseline for each technical replicate. Quantification cycle (Cq), threshold cycle (Ct), crossing point (Cp), and take-off point (TOP) refer to the same value from the real-time instrument. Use of quantification cycle (Cq), is preferable according to the RDML (Real-Time PCR Data Markup Language) data standard (http://www.rdml.org). Use ""NA"" (not zero) to indicate no amplification occurred.",M,Mandatory,If assay_type = targeted & amp_vis_method = qPCR,numeric,cycle,NA,NA,37.9450950622558,NA,gbifDNAext | MIQE,https://rs.gbif.org/extension/gbif/1.0/dna_derived_data_2022-02-23.xml,description
ampData | stdData,Targeted taxon detection,rfu,Relative Fluorescence Units (RFU),O,Optional,NA,numeric,No unit,NA,NA,7862.41,NA,new,NA,NA
stdData,Targeted taxon detection,efficiency,qPCR amplification efficiency calculated from slope,HR,Highly recommended,NA,numeric,%,NA,NA,95.0,NA,MIQE,NA,NA
stdData,Targeted taxon detection,r2,R-squared value of a qPCR standard curve. This shall be specific to each pcr_plate_id.,HR,Highly recommended,NA,numeric,NA,NA,NA,0.9867,NA,MIQE,NA,NA
stdData,Targeted taxon detection,slope,Slope of a qPCR standard curve. This shall be specific to each pcr_plate_id.,R,Recommended,NA,numeric,NA,NA,NA,-3.26,NA,MIQE,NA,NA
stdData,Targeted taxon detection,intercept,Intercept of a qPCR standard curve. This shall be specific to each pcr_plate_id.,R,Recommended,NA,numeric,NA,NA,NA,39.37,NA,MIQE,NA,NA
eLowQuantData,Targeted taxon detection,num_detect,Number of detection using the eLow Quant approach (described in DOI: 10.1002/edn3.220),HR,Highly recommended,NA,integer,NA,NA,NA,2.0,NA,new,NA,NA
ampData,Targeted taxon detection,estimatedNumberOfCopies_method,Method to output estimatedNumberOfCopies,R,Recommended,NA,controlled vocabulary,NA,NA,Ct/Cq with standard curve | Ct/Cq with standard bionomial data | direct output from the PCR instrument used | gel fluorescence intensities | other:,Ct/Cq with standard curve | Ct/Cq with standard bionomial data,NA,MIQE,NA,NA
ampData | eLowQuantData,Targeted taxon detection,estimatedNumberOfCopies,Estimated concentration of target molecules. Describe the approach taken to estimate it under the term estaimtedNumberOfCopies_method.,R,Recommended,If assay_type = targeted & pcr_0_1 = 1,numeric,NA,NA,NA,35.92426489978709,NA,gbifDNAext | MIQE,https://rs.gbif.org/extension/gbif/1.0/dna_derived_data_2022-02-23.xml,description
ampData | eLowQuantData,Targeted taxon detection,estimatedNumberOfCopies_unit,Unit for estimatedNumberOfCopies,R,Recommended,If assay_type = targeted & pcr_0_1 = 1,controlled vocabulary,NA,NA,copies/reaction | copies/µL of DNA extract | copies/µL of reaction | ng/reaction | ng/µL of DNA extract | ng/µL of reaction | other:,other:copies/mg of sediment sample,NA,new,NA,NA
ampData | eLowQuantData,Targeted taxon detection,estimatedNumberOfCopies_error,"The measure of variability (e.g., standard error) associated with the estimatedNumberOfCopies value, applicable when the estimatedNumberOfCopies represents an average calculated from multiple technical replicates per sample.",R,Recommended,NA,numeric,NA,NA,NA,0.14,NA,new,NA,NA
ampData | eLowQuantData,Targeted taxon detection,estimatedNumberOfCopies_error_type,"The specific type of variability measure (e.g., standard error, standard deviation) used to describe estimatedNumberOfCopies_error.",R,Recommended,NA,controlled vocabulary,NA,NA,standard error | standard deviation | 95% confidence interval | other:,standard error,NA,new,NA,NA
ampData,Targeted taxon detection,detected_notDetected_techRep,"Detection of the targeted taxon for each technical replicate, based on the detection criteria. Detected = 1, Not detected = 0.",HR,Highly recommended,NA,Boolean,NA,NA,0 | 1,1.0,NA,new,NA,NA
ampData,Targeted taxon detection,detected_notDetected_bioRep,"Detection of the targeted taxon for each biological replicate, based on the detection criteria. Detected = 1, Not detected = 0. Note that entries for each technical replicate within a biological sample (replicate) shoudl be repeated.",M,Mandatory,If assay_type = targeted & pcr_0_1 = 1,Boolean,NA,NA,0 | 1,1.0,NA,new,NA,NA
studyMetadata,Targeted taxon detection,targeted_detection_method_additional,"Additional information on targeted taxon detection method, that has not been shared in the given record.",O,Optional,NA,free text,NA,NA,NA,NA,NA,new,NA,NA
studyMetadata,Library preparation sequencing,barcoding_pcr_appr,PCR approach for metabarcoding,HR,Highly recommended,NA,controlled vocabulary,NA,NA,one-step PCR | two-step PCR | ligation-based | other:,two-step PCR,NA,Klymus et al 2024,NA,NA
studyMetadata,Library preparation sequencing,pcr2_thermocycler,"(If bacroding_pcr_appr = ""two-step PCR"") The manufacturer and model of a thermocycler used in the second step PCR",O,Optional,NA,free text,NA,NA,NA,"Thermo Fisher Scientific, QuantStudio 6",NA,new,NA,NA
studyMetadata,Library preparation sequencing,pcr2_amplificationReactionVolume,The total PCR reaction volume in the second step PCR,O,Optional,NA,numeric,µL,NA,NA,22.0,NA,new,NA,NA
studyMetadata,Library preparation sequencing,pcr2_commercial_mm,"(If bacroding_pcr_appr = ""two-step PCR"") Name, brand, and manufacture of commercial, pre-made master mix  in the second step PCR (if commercial master mix was used)",R,Recommended,NA,free text,NA,NA,NA,"Luna® Universal qPCR Master Mix, New England Biolabs",NA,new,NA,NA
studyMetadata,Library preparation sequencing,pcr2_custom_mm,"(If bacroding_pcr_appr = ""two-step PCR"") composition of custom master mix, including the names, volumes and concentrations of additives (i.e., salts, buffers, enzyme and other components)  in the second step PCR (if custom master mix was used)",R,Recommended,NA,free text,NA,NA,NA,"Each PCR reaction comprised: 1 x Taq Gold buffer (Applied Biosystems [ABI], USA), 2 nM MgCl2 (ABI, USA), 0.4 mg/mL BSA (Fisher Biotec, Australia), 0.25 mM dNTPs (Astral Scientific, Australia), 0.4 μM each of forward and reverse primers (Integrated DNA Technologies, Australia), 0.6 μL of 1/10,000 SYBR Green dye (Life Technologies, USA), 1 U of Taq polymerase Gold (ABI, USA), 2 μL of DNA, and made up to 25 μL with PCR grade water",NA,new,NA,NA
studyMetadata,Library preparation sequencing,pcr2_dna_vol,"(If bacroding_pcr_appr = ""two-step PCR"") Volume of DNA added in each reaction in the second step PCR",R,Recommended,NA,numeric,µL,NA,NA,2.0,NA,new,NA,NA
studyMetadata,Library preparation sequencing,pcr2_cond,"(If bacroding_pcr_appr = ""two-step PCR"") Description of reaction conditions and components of in the second PCR. The recommended format is ´initial denaturation:degrees_minutes;annealing:degrees_minutes;elongation:degrees_minutes;final elongation:degrees_minutes;total cycles´, where possible.",R,Recommended,NA,free text,NA,initial denaturation:degrees_minutes;annealing:degrees_minutes;elongation:degrees_minutes;final elongation:degrees_minutes;total cycles,NA,initial denaturation:94_3;annealing:50_1;elongation:72_1.5;final elongation:72_10;35,NA,new,NA,NA
studyMetadata,Library preparation sequencing,pcr2_annealingTemp,"(If bacroding_pcr_appr = ""two-step PCR"") The reaction temperature during the annealing phase of the second step PCR.",R,Recommended,NA,numeric,degree Celsius,NA,NA,60.0,NA,new,NA,NA
studyMetadata,Library preparation sequencing,pcr2_cycles,"(If bacroding_pcr_appr = ""two-step PCR"") Number of PCR cycles in the second step PCR",R,Recommended,NA,integer,cycles,NA,NA,40.0,NA,new,NA,NA
studyMetadata,Library preparation sequencing,pcr2_analysis_software,"(If bacroding_pcr_appr = ""two-step PCR"") The program used to analyse the PCR runs  in the second step PCR",O,Optional,NA,free text,NA,NA,NA,BIO-RAD QuantaSoft,NA,new,NA,NA
studyMetadata,Library preparation sequencing,pcr2_plate_id,"(If bacroding_pcr_appr = ""two-step PCR"") Plate ID in the second step PCR",R,Recommended,NA,free text,NA,NA,NA,20240802_pcr1,NA,new,NA,NA
studyMetadata,Library preparation sequencing,pcr2_method_additional,"(If bacroding_pcr_appr = ""two-step PCR"") Additional information on PCR or PCR-free method, that has not been shared in the given record in the second step PCR",O,Optional,NA,free text,NA,NA,NA,"Blocking primer (TAGTATAGCTACGAAGCCGAGGAGG-c3) (Wilcox et al. 2014, DOI 10.1007/s12686-013-0113-4) was applied to prevent elongation of a closely related species",NA,new,NA,NA
studyMetadata,Library preparation sequencing,sequencing_location,The location the sequencing run was performed. Indicate the name of the lab or core facility where samples were sequenced,O,Optional,NA,free text,NA,NA,NA,University of Maryland Genomics Resource Center,NA,mixs,https://w3id.org/mixs/0001156,NA
studyMetadata,Library preparation sequencing,platform,General sequencing platform used.,HR,Highly recommended,NA,controlled vocabulary,NA,NA,ILLUMINA | BGISEQ | CAPILLARY | DNBSEQ | ELEMENT | GENAPSYS | GENEMIND | HELICOS | ION_TORRENT | LS454 | OXFORD_NANOPORE | PACBIO_SMRT | TAPESTRI | VELA_DIAGNOSTICS | ULTIMA | other:,ILLUMINA,NA,INSDC,NA,NA
studyMetadata,Library preparation sequencing,instrument,Sequencing instrument (manufacturer and model) used. Where possible the term should be taken from the OBI list of DNA sequencers (https://ontobee.org/ontology/OBI?iri=http://purl.obolibrary.org/obo/OBI_0002750),HR,Highly recommended,NA,fixed format,NA,NA,INSTRUMENT NAME [OBI_xxxx],Illumina HiSeq 1500 [OBI_0003386],NA,INSDC,NA,NA
studyMetadata,Library preparation sequencing,seq_kit,The name of sequencing kit,HR,Highly recommended,NA,free text,NA,NA,NA,NextSeq 500/550 v2.5,NA,new,NA,Newly added
studyMetadata,Library preparation sequencing,lib_layout,"Specify whether to expect single, paired, or other configuration of reads",R,Recommended,NA,controlled vocabulary,NA,NA,paired end | single end | other:,paired end,NA,mixs | gbifDNAext,https://w3id.org/mixs/0000041,field_type
studyMetadata,Library preparation sequencing,adapter_forward,Forward sequencing adapter. The sequence should be reported in uppercase letters,R,Recommended,NA,free text,NA,NA,NA,AATGATACGGCGACCACCGAGATCTACACGCT,NA,mixs | gbifDNAext,https://w3id.org/mixs/0000048,Forward and reverse separated
studyMetadata,Library preparation sequencing,adapter_reverse,Reverse sequencing adapter. The sequence should be reported in uppercase letters,R,Recommended,NA,free text,NA,NA,NA,CAAGCAGAAGACGGCATACGAGAT,NA,new,NA,Forward and reverse separated
studyMetadata,Library preparation sequencing,lib_screen,Specific enrichment or screening methods applied before and/or after creating libraries,HR,Highly recommended,NA,free text,NA,NA,NA,"The library was size selected using a Pippin-Prep (Sage Science, Beverly, USA), purified using the Qiaquick PCR Purification Kit (Qiagen), quantified using a Qubit (Invitrogen) and diluted to 2 nM before loading it onto a MiSeq Flow Cell",NA,mixs | gbifDNAext,https://w3id.org/mixs/0000043,NA
experimentRunMetadata,Library preparation sequencing,lib_id,An identifier of a library (an amplicon of a sample with unique MIDs),M,Mandatory,NA,free text,NA,NA,NA,S01_MiSeq_run20230922,NA,new,NA,NA
experimentRunMetadata,Library preparation sequencing,seq_run_id,"A brief, concise identifier for sequencing run with no spaces or special characters, ensuring machine readability. This ID will be used in file names as 'seq_run_id'.",M,Mandatory,NA,free text,NA,NA,NA,run20230922,NA,new,NA,NA
experimentRunMetadata,Library preparation sequencing,lib_conc,The concentraion of the prepared library pool that was loaded onto the sequencing platform for a sequencing run.,R,Recommended,NA,numeric,NA,NA,NA,10.0,NA,new,NA,NA
experimentRunMetadata,Library preparation sequencing,lib_conc_unit,Unit for lib_conc,R,Recommended,NA,controlled vocabulary,NA,NA,ng/µL | nM | pM | other:,pM,NA,new,NA,NA
experimentRunMetadata,Library preparation sequencing,lib_conc_meth,Method to estimate lib_conc,R,Recommended,NA,free text,NA,NA,NA,Qubit Fluoromete,NA,new,NA,NA
experimentRunMetadata,Library preparation sequencing,phix_perc,"% of PhiX added into a library, if applicable",R,Recommended,NA,numeric,%,NA,NA,15.0,NA,new,NA,NA
experimentRunMetadata,Library preparation sequencing,mid_forward,"Forward multiplex Identifiers (MIDs), that was used to specifically tag unique samples in a sequencing run. Sequence should be reported in uppercase letters",O,Optional,NA,free text,NA,NA,NA,GTGAATAT,NA,mixs | gbifDNAext,https://w3id.org/mixs/0000047,Forward and reverse separated
experimentRunMetadata,Library preparation sequencing,mid_reverse,"Reverse multiplex Identifiers (MIDs), that was used to specifically tag unique samples in a sequencing run. Sequence should be reported in uppercase letters",O,Optional,NA,free text,NA,NA,NA,AACAAGCC,NA,new,NA,Forward and reverse separated
experimentRunMetadata,Library preparation sequencing,filename,"A file name of raw sequencing data. If paired end, fill filename2 for the reverse read",R,Recommended,NA,free text,NA,NA,NA,S01_R1.fastq,NA,new,NA,NA
experimentRunMetadata,Library preparation sequencing,filename2,A raw sequencing data file name of reverse reads if lib_layout = paired end,R,Recommended,NA,free text,NA,NA,NA,S01_R2.fastq,NA,new,NA,NA
studyMetadata,Library preparation sequencing,checksum_method,"The specific algorithm or technique used to compute the checksum (checksum_filename, checksum_filename2) for verifying data integrity. Examples include MD5, SHA-256, and CRC-32.",R,Recommended,NA,controlled vocabulary,NA,NA,MD5 | SHA-256 | other:,MD5,NA,new,NA,NA
experimentRunMetadata,Library preparation sequencing,checksum_filename,"The checksum of the forward sequence reads file (filename), used to verify the integrity and identity of the corresponding data file",R,Recommended,NA,free text,NA,NA,NA,e61e08bfd3ad5eb5d6e7da9e95b5feed,NA,new,NA,NA
experimentRunMetadata,Library preparation sequencing,checksum_filename2,"The checksum of the reverse sequence reads file (filename2), used to verify the integrity and identity of the corresponding data file",R,Recommended,NA,free text,NA,NA,NA,b3ea95ec13dae594bcb292dcf1b1ac7f,NA,new,NA,NA
experimentRunMetadata,Library preparation sequencing,associatedSequences,"A list (concatenated and separated) of identifiers (publication, global unique identifier, URI) of genetic sequence information associated with the samp_name",R,Recommended,NA,free text,NA,NA,NA,https://www.ncbi.nlm.nih.gov/sra/SRR26148187 | https://www.ncbi.nlm.nih.gov/biosample/SAMN37516094 | https://www.ncbi.nlm.nih.gov/bioproject/PRJNA887898,NA,dwc,http://rs.tdwg.org/dwc/terms/associatedSequences,description
studyMetadata,Library preparation sequencing,seq_method_additional,"Additional information on library preparation and sequencing method, that has not been shared in the given record.",O,Optional,NA,free text,NA,NA,NA,PhiX was spiked in at 15%,NA,new,NA,Newly added
studyMetadata,Bioinformatics,sop_bioinformatics,"Standard operating procedures, references, link to scripts, that were used in quality filtering, assembly and/or annotation of genomes, metagenomes or environmental sequences",R,Recommended,NA,free text,NA,NA,NA,https://github.com/mahsa-mousavi/eDNAFlow,NA,mixs | gbifDNAext,https://w3id.org/mixs/0000090,field_name | description
studyMetadata,Bioinformatics,trim_method,"Method for trimming primer and/or adapter sequences, including version and parameters",R,Recommended,NA,free text,NA,NA,NA,cutadapt v4.9,NA,NOAA,NA,field_name
studyMetadata,Bioinformatics,trim_param,Parameters and cutoffs used to trim if not default,R,Recommended,NA,free text,NA,NA,NA,ADAPTER;min_overlap=5,NA,new,NA,NA
studyMetadata,Bioinformatics,demux_tool,Software and the version used to demultiplex sequence reads,R,Recommended,NA,free text,NA,NA,NA,DADA2 1.26,NA,new,NA,Newly added
studyMetadata,Bioinformatics,demux_max_mismatch,Maximum mismatch allowed at the index bases for demultiplexing,R,Recommended,NA,integer,base pair,NA,NA,0.0,NA,new,NA,Newly added
studyMetadata,Bioinformatics,merge_tool,Software and the version to merge paired end reads,R,Recommended,NA,free text,NA,NA,NA,AdapterRemoval 2.3.3,NA,new,NA,Newly added
studyMetadata,Bioinformatics,merge_min_overlap,Minimum overlaps required to merge paired end reads,R,Recommended,NA,integer,base pair,NA,NA,12.0,NA,new,NA,Newly added
studyMetadata,Bioinformatics,min_len_cutoff,Minimum length threshold,R,Recommended,NA,integer,base pair,NA,NA,120.0,NA,new,NA,Newly added
studyMetadata,Bioinformatics,min_len_tool,Software and the version to remove reads shorter than minimum length threshold,R,Recommended,NA,free text,NA,NA,NA,OBITools3,NA,new,NA,Newly added
studyMetadata,Bioinformatics,error_rate_tool,Software to remove reads above error rate threshold,R,Recommended,NA,free text,NA,NA,NA,FASTQC v0.12.1,NA,new,NA,Newly added
studyMetadata,Bioinformatics,error_rate_type,A type/unit of error rate for the error rate threshold,R,Recommended,NA,controlled vocabulary,NA,NA,Phred score | expected error rate | other:,Phred score,NA,new,NA,Newly added
studyMetadata,Bioinformatics,error_rate_cutoff,error rate threshold,R,Recommended,NA,numeric,NA,NA,NA,25.0,NA,new,NA,Newly added
studyMetadata,Bioinformatics,chimera_check_method,"Description of chimera check approaches (i.e. denovo, reference-based), including software and the version used",R,Recommended,NA,free text,NA,NA,NA,"denovo, uchime v4.1",NA,mixs | gbifDNAext,https://w3id.org/mixs/0000052,description
studyMetadata,Bioinformatics,chimera_check_param,Parameters used to filter chimera sequences if note default,R,Recommended,NA,free text,NA,NA,NA,β parameter >=1,NA,new,NA,Newly added
studyMetadata,Bioinformatics,otu_clust_tool,Software and the version used for OTU/ASV clustering,R,Recommended,NA,free text,NA,NA,NA,q2-dada2 2019.1.0,NA,new,NA,Newly added
studyMetadata,Bioinformatics,otu_clust_cutoff,"The percentage similarity threshold used for OTU/ASV clustering. For ASV clustering, the cutoff is typically 100% similarity.",R,Recommended,NA,numeric,%,NA,NA,97.0,NA,mixs | gbifDNAext,https://w3id.org/mixs/0000085,field_name | description
studyMetadata,Bioinformatics,min_reads_cutoff,"minimum read counts thresholds. e.g., 10 reads, 5% relative read abundance, noise (e.g., (relative) read counts) detected in blanks. Answer either numeric value with the unit specified under the terms min_reads_cutoff_unit, ""noise detecte in blanks"", or ""other: FREE TEXT DESCRIPTION"".",R,Recommended,NA,numeric or controlled vocabulary,select from min_reeds_cutoff_unit,NA,numeric value | noise detected in blanks | other:,5.0,NA,new,NA,Newly added
studyMetadata,Bioinformatics,min_reads_cutoff_unit,"Unit of the min_reads_cutoff. i.e. reads, % relative read abundance",R,Recommended,NA,controlled vocabulary,NA,NA,reads | % | other:,%,NA,new,NA,Newly added
studyMetadata,Bioinformatics,min_reads_tool,Software and the version to remove reads below minimum read threshold,R,Recommended,NA,free text,NA,NA,NA,DADA2 1.26,NA,new,NA,Newly added
studyMetadata,Bioinformatics,otu_db,"List of reference database(s) (i.e. sequences not generated as part of the current study) along with version number, that were used to assign taxonomy to OTUs or ASVs. If custome database was used, enter 'custom' here, and provide the information of the database under the term otu_db_custom",HR,Highly recommended,NA,free text,NA,NA,NA,NCBI GenBank Release 260.0 | custom,NA,mixs | gbifDNAext,https://w3id.org/mixs/0000087,description
studyMetadata,Bioinformatics,otu_db_custom,"Description of custom reference database(s) (i.e. coverage of taxa, region) if applied to assign taxonomy to OTUs or ASVs",O,Optional,NA,free text,NA,NA,NA,"Unpublished custom database, containing COI sequences of 209 fish species collected from Western Australia (study area)",NA,new,NA,Newly added
studyMetadata,Bioinformatics,tax_assign_cat,"High level cetegory of taxonomic assignment approach. A sequence similarity approach include BLAST, MEGAN, custom R function to group sequences with 100% identify. A sequence composition approach includes naive bayes classifier, Remote Desktop Protocol (RDP) classification, Tourmaline, QIMME feature-classifier. Examples of phylogeny and probabilistic approaches are SEPP and PROTAX, respectively.",HR,Highly recommended,NA,controlled vocabulary,NA,NA,sequence similarity | sequence composition | phylogeny | probabilistic | other:,sequence similarity,NA,new,NA,Newly added
studyMetadata,Bioinformatics,otu_seq_comp_appr,Alignment tool/software used for taxonomic assignment,HR,Highly recommended,NA,free text,NA,NA,NA,blastn;2.6.0+,NA,mixs | gbifDNAext,https://w3id.org/mixs/0000086,description
studyMetadata,Bioinformatics,tax_class_id_cutoff,Minimum percent identity for taxonomic assignment,R,Recommended,NA,numeric,%,NA,NA,90.0,NA,new,NA,Newly added
studyMetadata,Bioinformatics,tax_class_query_cutoff,Minimum percent query coverage for taxonomic assignment,R,Recommended,NA,numeric,%,NA,NA,98.0,NA,new,NA,Newly added
studyMetadata,Bioinformatics,tax_class_collapse,How was the taxa collapsed to higher taxonomic levels? i.e. lowest common ancestor,R,Recommended,NA,free text,NA,NA,NA,"Taxonomic levels were dropped to the lowest common ancestor (LCA) with the similarity thresholds of 99%, and also based on % identify thresholds (>98% species, 95-98% genus, 90-95% family).",NA,new,NA,Newly added
studyMetadata,Bioinformatics,tax_class_other,"Additional information on parameters and cutoffs used for taxonomic assignment, that have not been shared in the given record.",R,Recommended,NA,free text,NA,NA,NA,NEED AN EXAMPLE HERE,NA,mixs | gbifDNAext,https://w3id.org/mixs/0000064,description
