data_type,section,term_name,description,requirement_level_code,requirement_level,requirement_level_condition,term_type,unit,fixed_format,controlled_vocabulary_options,example,sample_type_specificity,source,URI,modifications.made
sampleMetadata,Sample preparation,precip_chem_prep,Chemicals used in precipitation at the sample preparation step prior to DNA extraction,HR,Highly recommended,If applicable,controlled vocabulary,NA,NA,ethanol | isopropanol | sodium chloride | other:,ethanol | sodium chloride,Water | Soil | Sediment,thalinger2020,NA,field_name | description
sampleMetadata,Sample preparation,precip_force_prep,Force used for precipitation at the sample preparation step prior to DNA extraction,HR,Highly recommended,If applicable,numeric,x g,NA,NA,20000.0,Water | Soil | Sediment,thalinger2020,NA,field_name | description
sampleMetadata,Sample preparation,precip_time_prep,Time of centrifugation for precipitation at the sample preparation step prior to DNA extraction,HR,Highly recommended,If applicable,numeric,minute,NA,NA,45.0,Water | Soil | Sediment,thalinger2020,NA,field_name | description
sampleMetadata,Sample preparation,precip_temp_prep,Temperature during centrifugation for precipitation at the sample preparation step prior to DNA extraction,HR,Highly recommended,If applicable,numeric or controlled vocabulary,degree Celsius,NA,numeric value | ambient temperature | other:,10.0,Water | Soil | Sediment,thalinger2020,NA,field_name | description
sampleMetadata,Sample preparation,prepped_samp_store_temp,"Temperature at which the prepared sample was stored prior to DNA extraction. Record either 'ambient' or a numeric value in degree Celsius. Note: The storage temprature of the original environmental sample (e.g., water, soil) should be recorded under samp_store_temp, while the current term is for the ""processed"" sample such as filter paper, homogenised and subsampled sediment, prepared for DNA extraction.",R,Recommended,If applicable,numeric or controlled vocabulary,degree Celsius,NA,numeric value | ambient temperature | other:,ambient temperature,ALL,thalinger2020,NA,field_name | description | field_type
sampleMetadata,Sample preparation,prepped_samp_store_sol,"Solution within which the prepared sample was stored prior to DNA extraction. Note: The storage solution of the original environmental sample (e.g., water, soil) should be recorded under samp_store_sol, while the current term is for the ""processed"" sample such as filter paper, homogenised and subsampled sediment, prepared for DNA extraction.",R,Recommended,If applicable,controlled vocabulary,NA,NA,ethanol | sodium acetate | longmire | lysis buffer | none | other:,lysis buffer,ALL,new,NA,Newly added
sampleMetadata,Sample preparation,prepped_samp_store_dur,"Duration for which the prepared sample was stored prior to DNA extraction, written in ISO 8601 format (i.e., P14D for 14 days period. P1Y6M for 1 year and 6 months period. P1W/4W for some time between 1 and 4 weeks). Note: The storage duration of the original environmental sample (e.g., water, soil) should be recorded under samp_store_dur, while the current term is for the ""processed"" sample such as filter paper, homogenised and subsampled sediment, prepared for DNA extraction.",R,Recommended,If applicable,fixed format,NA,PnYnMnWnDTnHnMnS,NA,P1Y6M,ALL,new,NA,Newly added
sampleMetadata,Sample preparation,prep_method_additional,"Additional information on sample preparation, storage and preservation prior to DNA extraction, that has not been shared in the given record",O,Optional,If applicable,free text,NA,NA,NA,"See Villacorta-Rath et al. (2020) (doi.org/10.1002/edn3.114) for the detailed precipitation protocols. ATL lysis buffer was used for prepped_samp_store_sol. Prepped_samp_store_temp was ambient, average of 22 degree Celsius",ALL,new,NA,Newly added
sampleMetadata,Nucleic acid extraction,date_ext,"Date of nucleic acid extraction, written in ISO 8601 format",O,Optional,NA,fixed format,NA,NA,NA,2008-01-23T19:23-06:00,NA,new,NA,NA
sampleMetadata,Nucleic acid extraction,samp_vol_we_dna_ext,"Volume or mass of sample or subsamples that was processed for DNA extraction. For example, if 1L of water was collected and filtered, and half of the filter paper was used for DNA extraction, the entries of samp_size and samp_vol_we_dna_ext should be 1L and 500mL respectively. Specify the unit under the term samp_vol_ext_unit.",HR,Highly recommended,NA,numeric,select from samp_vol_ext_unit,NA,NA,1500.0,NA,mixs | gbifDNAext,https://w3id.org/mixs/0000111,description
sampleMetadata,Nucleic acid extraction,samp_vol_we_dna_ext_unit,Unit for samp_vol_we_dna_ext,HR,Highly recommended,NA,controlled vocabulary,NA,NA,mL | L | mg | g | kg | cm2 | m2 | cm3 | m3 | other:,mL,NA,new,NA,Newly added
sampleMetadata,Nucleic acid extraction,nucl_acid_ext_lysis,"The approach used to lyse DNA-containing material. For example, physical methods may involve freeze-thaw cycles or the uses of bead mills, homogenizers and sonicators. Thermal methods apply high temperatures, often used in combination wiht other methods.",R,Recommended,NA,controlled vocabulary,NA,NA,physical | chemical | enzymatic | thermal | osmotic | other:,enzymatic,NA,new,NA,NA
sampleMetadata,Nucleic acid extraction,nucl_acid_ext_sep,The approach used to separate DNA from a mixture.,R,Recommended,NA,controlled vocabulary,NA,NA,column-based | magnetic beads | centrifugation | precipitation | phenol chloroform | gel electrophoresis | other:,column-based,NA,new,NA,NA
sampleMetadata,Nucleic acid extraction,nucl_acid_ext,"A link to a literature reference, electronic resource or a standard operating procedure (SOP), that describes the material separation to recover the nucleic acid fraction from a sample. If a custom extraction method has been developed and applied to the samples within this dataset, it is Highly recommended to make the SOP available and provide the link here.",HR,Highly recommended,NA,free text,NA,NA,NA,https://www.qiagen.com/us/resources/resourcedetail?id=5a0517a7-711d-4085-8a28-2bb25fab828a&lang=en,NA,mixs | gbifDNAext,https://w3id.org/mixs/0000037,description
sampleMetadata,Nucleic acid extraction,nucl_acid_ext_kit,The name of the extraction kit used to recover the nucleic acid fraction of an input material,HR,Highly recommended,NA,free text,NA,NA,NA,Qiagen PowerSoil Kit,NA,mixs,https://w3id.org/mixs/0001223,description
sampleMetadata,Nucleic acid extraction,nucl_acid_ext_modify,"Description of modification made from a commercial or established protocol (nucl_acid_ext), if made.",R,Recommended,NA,free text,NA,NA,NA,"Sample was lysed in 540 µL of ATL buffer and 60 µL of Proteinase K, and eluted in 100 µL of buffer EB, instead of 180 µL, 20 µL and 200 µL respectively",NA,thalinger2020,NA,field_name
sampleMetadata,Nucleic acid extraction,dna_cleanup_0_1,"Was the extracted DNA cleaned/purified? Yes = 1, No =0",R,Recommended,NA,Boolean,NA,NA,0 | 1,1.0,NA,new,NA,Newly added
sampleMetadata,Nucleic acid extraction,dna_cleanup_method,A description of DNA clean-up method. Provide the name of a commercial kit if used.,R,Recommended,If dna_cleanup_0_1 is 1,free text,NA,NA,NA,Zymo DNA Clean & Concentrator Kits,NA,new,NA,Newly added
sampleMetadata,Nucleic acid extraction,concentration,Concentration of total DNA after extraction,R,Recommended,NA,numeric,NA,NA,NA,67.5,NA,gbifDNAext,https://rs.gbif.org/extension/gbif/1.0/dna_derived_data_2022-02-23.xml,description
sampleMetadata,Nucleic acid extraction,concentration_unit,unit of total DNA concentration after extraction,R,Recommended,NA,controlled vocabulary,NA,NA,ng/µl | copies/µl | other:,ng/µl,NA,new,NA,NA
sampleMetadata,Nucleic acid extraction,concentration_method,Description of method/instrument used for concentration measurement,O,Optional,NA,free text,NA,NA,NA,Qubit 4.0 Fluorometer (Invitrogen),NA,gbifDNAext,https://rs.gbif.org/extension/gbif/1.0/dna_derived_data_2022-02-23.xml,field_name | description
sampleMetadata,Nucleic acid extraction,ratioOfAbsorbance260_280,"Ratio of absorbance at 260 nm and 230 nm assessing DNA purity (mostly secondary measure, indicates mainly EDTA, carbohydrates, phenol).",O,Optional,NA,numeric,NA,NA,NA,2.1,NA,gbifDNAext,https://rs.gbif.org/extension/gbif/1.0/dna_derived_data_2022-02-23.xml,description
sampleMetadata,Nucleic acid extraction,pool_dna_num,The number of extracts that were pooled in to one sample before PCR,R,Recommended,NA,integer,NA,NA,NA,2.0,NA,mixs,https://w3id.org/mixs/0000325,description | field_type | field_name
sampleMetadata,Nucleic acid extraction,nucl_acid_ext_method_additional,"Additional information on nucleic acid extraction method, that has not been shared in the given record.",O,Optional,NA,free text,NA,NA,NA,NA,NA,new,NA,NA
studyMetadata,PCR,pcr_0_1,"Was PCR performed in the study? Yes = 1, No (pcr-free approaches including shotgun metagenomics, Nanopore) = 0",M,Mandatory,NA,Boolean,NA,NA,0 | 1,1.0,NA,new,NA,Newly added
studyMetadata,PCR,inhibition_check_0_1,"Was the inhibition checked? Yes = 1, No = 0",O,Optional,NA,Boolean,NA,NA,NA,1.0,NA,new,NA,NA
studyMetadata,PCR,inhibition_check,"Description of method applied to detect inhibition and any adjustments made to improve PCR performance, such as sample dilution or the use of inhibitor-tolerant reagents.",O,Optional,NA,free text,NA,NA,NA,"The extracted DNA was tested using a serial dilution approach (undiluted, 1:10, 1:100). qPCR was performed on each dilution to evaluate amplification efficiency and inhibition. The dillution with optimal performance with reduced inhibition was selected for subsequent analysis in the workflow.",NA,new,NA,NA
studyMetadata,PCR,thermocycler,The manufacturer and model of a thermocycler used,O,Optional,NA,free text,NA,NA,NA,"Thermo Fisher Scientific, QuantStudio 6",NA,MIQE,NA,NA
ampData | stdData,PCR,technical_rep_id,An integer uniquely identifying a specific PCR technical replicate within a sample.,M,Mandatory,NA,integer,NA,NA,NA,1.0,NA,new,NA,NA
studyMetadata | sampleMetadata | ampData | experimentRunMetadata | stdData | eLowQuantData,PCR,assay_name,"A brief, concise identifier for assay with no spaces or special characters, ensuring machine readability. This ID will be used in file names as 'assay_name'.",M,Mandatory,NA,free text,NA,NA,NA,MiFish (metabarcoding) / eSERU5 (qPCR),NA,new,NA,NA
studyMetadata,PCR,assay_validation,"How was the assay validated for specificify? e.g., in-silico, in-vitro, in-situ validations, sanger sequencing, repeat analysis with alternate assay, intra/inter species tests",R,Recommended,NA,free text,NA,NA,NA,"The assay was validated through a multi-step process, including in-silico analysis, in-vitro testing, in-situ trials, and final confirmation with Sanger sequencing.",NA,new,NA,Newly added
studyMetadata,PCR,targetTaxonomicAssay,"Taxa or species name targeted by the primers, probes, and/or other approaches applied in the PCR.",M,Mandatory,"If pcr_0_1 is 1. Else, recommended",free text,NA,NA,NA,verteberate,NA,new,NA,"Newly added, following the name style of targetTaxonomicScope"
studyMetadata,PCR,targetTaxonomicScope,"The taxonomic group(s) targeted in the study. This can differ from the targetTaxonomicPCR. For example, the targetTaxonomicPCR may be Chordata while the targetTaxonomicScope is Chondrichthyes (bony fish, sharks and rays).",R,Recommended,NA,free text,NA,NA,NA,teleost,NA,Humboldt ext,http://rs.tdwg.org/eco/terms/targetTaxonomicScope,NA
studyMetadata,PCR,target_gene,Targeted gene or locus name for marker gene studies,HR,Highly recommended,NA,controlled vocabulary,NA,NA,12S rRNA | 16S rRNA | 18S rRNA | 23S rRNA | 28S rRNA | rbcL | CytB | COI | COII | COIII | nifH | ITS | ND1 | ND2 | ND3 | ND4 | ND5 | ND6 | amoA | rpoB | rpoC1 | rpoC2 | matK | trnH | trnL | psbK | D-loop | other:,COI,NA,mixs | gbifDNAext,https://w3id.org/mixs/0000044,field_type
studyMetadata,PCR,target_subfragment,Name of subfragment of a gene or locus. Important to e.g. identify special regions on marker genes like V6 on 16S rRNA.,O,Optional,NA,free text,NA,NA,NA,V6,NA,mixs | gbifDNAext,https://w3id.org/mixs/0000045,NA
studyMetadata,PCR,ampliconSize,"The length of the amplicon in basepairs EXCLUDING the primers, adapters and MIDs. If it's a range, use pipe (i.e. 140 | 160)",HR,Highly recommended,NA,integer,basepairs,NA,NA,83.0,NA,gbifDNAext | MIQE,https://rs.gbif.org/extension/gbif/1.0/dna_derived_data_2022-02-23.xml,description
studyMetadata,PCR,pcr_primer_forward,"Forward PCR primer (5' - 3') that were used to amplify the sequence of the targeted gene. The primer sequence should NOT contain MIDs and adapter sequences, and should be reported in uppercase letters. If multiple forward primers are present in a single PCR reaction, either report them separately in separate submissions (with separate OTU tables for each primer set), or list the primers here separated by pipe ( | ) and provide one OTU table resulting from all the primers applied here. The latter is recommended only when the multiple primers target the same gene region and thus a single OTU table was generated from the multiplexed PCR. This term is required except for PCR free methods.",M,Mandatory,If pcr_0_1 is 1,free text,NA,NA,NA,GGWACWGGWTGAACWGTWTAYCCYCC,NA,gbifDNAext,https://rs.gbif.org/extension/gbif/1.0/dna_derived_data_2022-02-23.xml,description
studyMetadata,PCR,pcr_primer_reverse,"Reverse PCR primer (5' - 3') that were used to amplify the sequence of the targeted gene. The primer sequence should NOT contain MIDs and adapter sequences, and should be reported in uppercase letters. If multiple reverse primers are present in a single PCR reaction, either report them separately in separate submissions (with separate OTU tables for each primer set), or list the primers here separated by pipe ( | ) and provide one OTU table resulting from all the primers applied here. The latter is recommended only when the multiple primers target the same gene region and thus a single OTU table was generated from the multiplexed PCR. This term is required except for PCR free methods.",M,Mandatory,If pcr_0_1 is 1,free text,NA,NA,NA,GGRGGRTASACSGTTCASCCSGTSCC,NA,gbifDNAext,https://rs.gbif.org/extension/gbif/1.0/dna_derived_data_2022-02-23.xml,description
studyMetadata,PCR,pcr_primer_name_forward,"Name of the pcr_primer_forward. If multiple primers are listed in pcr_primer_forward, list the names respectively, separated by pipe ( | ).",R,Recommended,NA,free text,NA,NA,NA,mlCOIintF,NA,gbifDNAext,https://rs.gbif.org/extension/gbif/1.0/dna_derived_data_2022-02-23.xml,description
studyMetadata,PCR,pcr_primer_name_reverse,"Name of the pcr_primer_reverse. If multiple primers are listed in pcr_primer_reverse, list the names respectively, separated by pipe ( | ).",R,Recommended,NA,free text,NA,NA,NA,mlCOIintR,NA,gbifDNAext,https://rs.gbif.org/extension/gbif/1.0/dna_derived_data_2022-02-23.xml,description
studyMetadata,PCR,pcr_primer_reference_forward,"Reference (i.e. DOI) of the pcr_primer_forward. If multiple primers are listed in pcr_primer_forward, list the references respectively, separated by pipe ( | ).",HR,Highly recommended,NA,free text,NA,NA,NA,https://doi.org/10.1186/1742-9994-10-34,NA,gbifDNAext,https://rs.gbif.org/extension/gbif/1.0/dna_derived_data_2022-02-23.xml,Forward and reverse separated
studyMetadata,PCR,pcr_primer_reference_reverse,"Reference (i.e. DOI) of the pcr_primer_reverse. If multiple primers are listed in pcr_primer_reverse, list the references respectively, separated by pipe ( | ).",HR,Highly recommended,NA,free text,NA,NA,NA,https://doi.org/10.1186/1742-9994-10-34,NA,gbifDNAext,https://rs.gbif.org/extension/gbif/1.0/dna_derived_data_2022-02-23.xml,Forward and reverse separated
studyMetadata,PCR,pcr_primer_vol_forward,Volume of pcr_primer_forward per reaction,R,Recommended,NA,numeric,µL,NA,NA,2.0,NA,new,NA,NA
studyMetadata,PCR,pcr_primer_vol_reverse,Volume of pcr_primer_reverse per reaction,R,Recommended,NA,numeric,µL,NA,NA,2.0,NA,new,NA,NA
studyMetadata,PCR,pcr_primer_conc_forward,"The stock concentration of the forward PCR primer (pcr_primer_forward). This refers specifically to the concentration of the primer stock solution, not the final concentration in the PCR reaction. For example, using 1 µL of a 5 µM (stock concentration) primer in a 25 µL reaction results in a final concentration of 0.2 µM. Hence the entry for this term would be 5.",R,Recommended,NA,numeric,µM,NA,NA,5.0,NA,miqe,NA,NA
studyMetadata,PCR,pcr_primer_conc_reverse,"The stock concentration of the forward PCR primer (pcr_primer_reverse). This refers specifically to the concentration of the primer stock solution, not the final concentration in the PCR reaction. For example, using 1 µL of a 5 µM (stock concentration) primer in a 25 µL reaction results in a final concentration of 0.2 µM. Hence the entry for this term would be 5.",R,Recommended,NA,numeric,µM,NA,NA,5.0,NA,miqe,NA,NA
studyMetadata,PCR,probeReporter,"Type of fluorophore (reporter) used. Probe anneals within amplified target DNA. Polymerase activity degrades the probe that has annealed to the template, and the probe releases the fluorophore from it and breaks the proximity to the quencher, thus allowing fluorescence of the fluorophore.",HR,Highly recommended,NA,free text,NA,NA,NA,FAM,NA,gbifDNAext | MIQE,https://rs.gbif.org/extension/gbif/1.0/dna_derived_data_2022-02-23.xml,NA
studyMetadata,PCR,probeQuencher,"Type of quencher used. The quencher molecule quenches the fluorescence emitted by the fluorophore when excited by the cycler’s light source As long as fluorophore and the quencher are in proximity, quenching inhibits any fluorescence signals.",HR,Highly recommended,NA,controlled vocabulary,NA,NA,Zero-End Quencher (ZEN) | TAMRA | lowa Black | Minor Groove Binder (MGB) | Black Hole Quencher (BHQ) | other:,MGB,NA,gbifDNAext | MIQE,https://rs.gbif.org/extension/gbif/1.0/dna_derived_data_2022-02-23.xml,field_type
studyMetadata,PCR,probe_seq,"If applicable, probe sequence in the 5' to 3' direction",HR,Highly recommended,NA,free text,NA,NA,NA,CTTGTTTGTTTGATCAATTC,NA,new,NA,Newly added
studyMetadata,PCR,probe_ref,Reference (i.e. DOI) of the probe_seq,HR,Highly recommended,NA,free text,NA,NA,NA,10.1007/s00227-017-3141-x,NA,new,NA,Newly added
studyMetadata,PCR,probe_conc,"The stock concentration of the probe if applicable. This refers specifically to the concentration of the probe stock solution, not the final concentration in the PCR reaction. For example, using 1 µL of a 5 µM (stock concentration) probe in a 25 µL reaction results in a final concentration of 0.2 µM. Hence the entry for this term would be 5.",HR,Highly recommended,NA,numeric,nM,NA,NA,100.0,NA,miqe,NA,NA
studyMetadata,PCR,commercial_mm,"Name, brand, and manufacture of commercial, pre-made master mix (if commercial master mix was used)",HR,Highly recommended,NA,free text,NA,NA,NA,"Luna® Universal qPCR Master Mix, New England Biolabs",NA,MIQE,NA,NA
studyMetadata,PCR,custom_mm,"composition of custom master mix, including the names, volumes and concentrations of additives (i.e., salts, buffers, enzyme and other components) (if custom master mix was used)",HR,Highly recommended,NA,free text,NA,NA,NA,"Each PCR reaction comprised: 1 x Taq Gold buffer (Applied Biosystems [ABI], USA), 2 nM MgCl2 (ABI, USA), 0.4 mg/mL BSA (Fisher Biotec, Australia), 0.25 mM dNTPs (Astral Scientific, Australia), 0.4 μM each of forward and reverse primers (Integrated DNA Technologies, Australia), 0.6 μL of 1/10,000 SYBR Green dye (Life Technologies, USA), 1 U of Taq polymerase Gold (ABI, USA), 2 μL of DNA, and made up to 25 μL with PCR grade water",NA,MIQE,NA,NA
studyMetadata,PCR,block_seq,Blocking primer sequence in the 5' to 3' direction,O,Optional,NA,free text,NA,NA,NA,AGCTTTAGACACCAAGGCAGACCAT/C3/,NA,new,NA,NA
studyMetadata,PCR,block_ref,"Reference of a blocking primer. Enter ""custom"" if it was developed during the current project",O,Optional,NA,free text,NA,NA,NA,https://doi.org/10.1038/s41598-020-60779-9,NA,new,NA,NA
studyMetadata,PCR,block_taxa,"Taxonomic name(s) of the organism(s) targeted by a blocking primer to prevent their DNA amplification during PCR, enabling the preferential amplification of other taxa.",O,Optional,NA,free text,NA,NA,NA,Lutjanus malabaricus,NA,new,NA,NA
studyMetadata,PCR,amplificationReactionVolume,The total PCR reaction volume,R,Recommended,NA,numeric,µL,NA,NA,22.0,NA,gbifDNAext | MIQE,https://rs.gbif.org/extension/gbif/1.0/dna_derived_data_2022-02-23.xml,NA
studyMetadata,PCR,pcr_dna_vol,Volume of DNA added in each PCR reaction,HR,Highly recommended,NA,numeric,µL,NA,NA,2.0,NA,MIQE,NA,NA
studyMetadata,PCR,pcr_rep,"The number of PCR technical replicates. For metabarcoding, each replicate should employ an identical MID.",HR,Highly recommended,NA,integer,NA,NA,NA,3.0,NA,new,NA,NA
studyMetadata,PCR,nucl_acid_amp,"A link to a literature reference, electronic resource or a standard operating procedure (SOP), that describes the nucleic acid amplification",R,Recommended,NA,free text,NA,NA,NA,https://phylogenomics.me/protocols/16s-pcr-protocol/,NA,mixs,https://w3id.org/mixs/0000038,description
studyMetadata,PCR,pcr_cond,"Description of reaction conditions and components of PCR. The recommended format is ´initial denaturation:degrees_minutes;annealing:degrees_minutes;elongation:degrees_minutes;final elongation:degrees_minutes;total cycles´, where possible. If two-step PCR was applied, enter the second PCR protocol under the term pcr2_cond in the library preperation/sequencing section.",HR,Highly recommended,NA,free text,NA,initial denaturation:degrees_minutes;annealing:degrees_minutes;elongation:degrees_minutes;final elongation:degrees_minutes;total cycles,NA,initial denaturation:94_3;annealing:50_1;elongation:72_1.5;final elongation:72_10;35,NA,mixs | gbifDNAext,https://w3id.org/mixs/0000049,description
studyMetadata,PCR,annealingTemp,"The reaction temperature during the annealing phase of PCR. If two-step PCR was applied, enter the second PCR protocol under the term pcr2_* in the library preperation/sequencing section.",HR,Highly recommended,NA,numeric,degree Celsius,NA,NA,60.0,NA,gbifDNAext | MIQE,https://rs.gbif.org/extension/gbif/1.0/dna_derived_data_2022-02-23.xml,NA
studyMetadata,PCR,pcr_cycles,"Number of PCR cycles. If two-step PCR was applied, enter the second PCR protocol under the term pcr2_* in the library preperation/sequencing section.",HR,Highly recommended,NA,integer,cycles,NA,NA,40.0,NA,nmdc,https://w3id.org/nmdc/pcr_cycles,description
studyMetadata,PCR,pcr_analysis_software,"The program used to analyse the PCR runs. If two-step PCR was applied, enter the second PCR protocol under the term pcr2_* in the library preperation/sequencing section.",O,Optional,NA,free text,NA,NA,NA,BIO-RAD QuantaSoft,NA,gbifDNAext,https://rs.gbif.org/extension/gbif/1.0/dna_derived_data_2022-02-23.xml,description
experimentRunMetadata | ampData | stdData,PCR,pcr_plate_id,"PCR plate ID. If two-step PCR was applied, enter the second PCR protocol under the term pcr2_* in the library preperation/sequencing section.",HR,Highly recommended,NA,free text,NA,NA,NA,20240802_pcr1,NA,new,NA,NA
studyMetadata,PCR,pcr_method_additional,"Additional information on PCR or PCR-free method, that has not been shared in the given record (i.e. multiplexing, hybridisation, CRISPR-Cas). If two-step PCR was applied, enter the second PCR protocol under the term pcr2_* in the library preperation/sequencing section.",O,Optional,NA,free text,NA,NA,NA,"Blocking primer (TAGTATAGCTACGAAGCCGAGGAGG-c3) (Wilcox et al. 2014, DOI 10.1007/s12686-013-0113-4) was applied to prevent elongation of a closely related species",NA,new,NA,Newly added
studyMetadata,Targeted taxon detection,amp_vis_method,"Amplicon visualisation method (i.e., qPCR, dPCR, gel electrophoresis, PCR capillary electrophoresis (PCR-CE), Loop-mediated isothermal amplification (LAMP)) to determine the detection of a targeted taxon",M,Mandatory,If assay_type = targeted & pcr_0_1 = 1,controlled vocabulary,NA,NA,qPCR | dPCR | gel electrophoresis | CE-PCR | LAMP | other:,qPCR,NA,new,NA,NA
studyMetadata,Targeted taxon detection,detection_criteria,"Criteria to determine positive detection. For example, a certain number of positive amplifications per sample, sanger sequencing of amplicons",M,Mandatory,If assay_type = targeted & pcr_0_1 = 1,free text,NA,NA,NA,The minimum number of PCR replicates of 2 with positive amplification,NA,thalinger2020,NA,field_name | description
studyMetadata,Targeted taxon detection,lod_method,"Method used for determining LOD e.g., DOI of a published procedure",R,Recommended,NA,free text,NA,NA,NA,DOI: 10.1002/edn3.220,NA,new,NA,NA
studyMetadata,Targeted taxon detection,pcr_assay_lod_techreps,The number of technical replicates that the LOD is applied to. See DOI: 10.1002/edn3.220,R,Recommended,NA,integer,NA,NA,NA,8.0,NA,new,NA,NA
studyMetadata,Targeted taxon detection,pcr_assay_lod,Assay's limit of detection (LOD) (the lowest amount of target taxon DNA that can be detected with a defined level of confidence).,M,Mandatory,If assay_type = targeted & pcr_0_1 = 1,numeric,NA,NA,NA,51.0,NA,gbifDNAext | MIQE,https://rs.gbif.org/extension/gbif/1.0/dna_derived_data_2022-02-23.xml,field_name | description
studyMetadata,Targeted taxon detection,pcr_assay_lod_unit,Unit for pcr_assay_lod,M,Mandatory,If assay_type = targeted & pcr_0_1 = 1,controlled vocabulary,NA,NA,copies/reaction | copies/µL | ng/reaction | ng/µL | other:,ng/µL,NA,new,NA,NA
studyMetadata,Targeted taxon detection,pcr_assay_lod_UL,Upper 95% confidence limit for LOD for a given number of technical replicates. See DOI: 10.1002/edn3.220,R,Recommended,NA,numeric,same as pcr_assay_lod_unit,NA,NA,NA,NA,new,NA,NA
studyMetadata,Targeted taxon detection,pcr_assay_lod_LL,Lower 95% confidence limit for LOD for a given number of technical replicates. See DOI: 10.1002/edn3.220,R,Recommended,NA,numeric,same as pcr_assay_lod_unit,NA,NA,NA,NA,new,NA,NA
